id,year,title,event_type,authors
2772,2005,Describing Visual Scenes using Transformed Dirichlet Processes,,"['William T. Freeman', 'Erik B. Sudderth', 'Alan S. Willsky', 'Antonio Torralba']"
2773,2005,Silicon growth cones map silicon retina,,"['Kwabena Boahen', 'Brian Taba']"
2774,2005,Learning Multiple Related Tasks using Latent Independent Component Analysis,,"['Zoubin Ghahramani', 'Jian Zhang', 'Yiming Yang']"
2775,2005,Data-Driven Online to Batch Conversions,,"['Yoram Singer', 'Ofer Dekel']"
2776,2005,Modeling Neural Population Spiking Activity with Gibbs Distributions,,"['Michael J. Black', 'Frank Wood', 'Stefan Roth']"
2777,2005,Stimulus Evoked Independent Factor Analysis of MEG Data with Large Background Activity,,"['Srikantan S. Nagarajan', 'Kenneth Hild', 'Kensuke Sekihara', 'Hagai T. Attias']"
2778,2005,From Weighted Classification to Policy Search,,"['Doron Blatt', 'Alfred O. Hero']"
2779,2005,Generalization Error Bounds for Aggregation by Mirror Descent with Averaging,,"['Anatoli Juditsky', 'Alexander Nazin', 'Alexandre Tsybakov', 'Nicolas Vayatis']"
2780,2005,Spectral Bounds for Sparse PCA: Exact and Greedy Algorithms,,"['Yair Weiss', 'Baback Moghaddam', 'Shai Avidan']"
2781,2005,Analyzing Coupled Brain Sources: Distinguishing True from Spurious Interaction,,"['Klaus-Robert M?ller', 'Andreas Ziehe', 'Guido Nolte', 'Frank Meinecke']"
2782,2005,Temporally changing synaptic plasticity,,"['Bernd Porr', 'Florentin W?rg?tter', 'Minija Tamosiunaite']"
2783,2005,Gaussian Process Dynamical Models,,"['David M. Blei', 'Aaron Hertzmann', 'Jack Wang']"
2784,2005,Factorial Switching Kalman Filters for Condition Monitoring in Neonatal Intensive Care,,"['Christopher Williams', 'John Quinn', 'Neil Mcintosh']"
2785,2005,Learning to Control an Octopus Arm with Gaussian Process Temporal Difference Methods,,"['Yaakov Engel', 'Peter Szabo', 'Dmitry Volkinshtein']"
2786,2005,Oblivious Equilibrium: A Mean Field Approximation for Large-Scale Dynamic Games,,"['Benjamin Van Roy', 'Gabriel Y. Weintraub', 'Lanier Benkard']"
2787,2005,Subsequence Kernels for Relation Extraction,,"['Raymond J. Mooney', 'Razvan C. Bunescu']"
2788,2005,Hot Coupling: A Particle Approach to Inference and Normalization on Pairwise Undirected Graphs,,"['Firas Hamze', 'Nando de Freitas']"
2789,2005,Large scale networks fingerprinting and visualization using the k-core decomposition,,"['J. I. Alvarez-hamelin', ""Luca Dall'asta"", 'Alain Barrat', 'Alessandro Vespignani']"
279,1989,Note on Development of Modularity in Simple Cortical Models,,"['Alex Chernajvsky', 'John E. Moody']"
2790,2005,Convergence and Consistency of Regularized Boosting Algorithms with Stationary B-Mixing Observations,,"['Robert E. Schapire', 'Aurelie C. Lozano', 'Sanjeev R. Kulkarni']"
2791,2005,Gaussian Processes for Multiuser Detection in CDMA receivers,,"['Fernando P?rez-Cruz', 'Juan J. Murillo-fuentes', 'Sebastian Caro']"
2792,2005,Robust Fisher Discriminant Analysis,,"['Seung-jean Kim', 'Alessandro Magnani', 'Stephen Boyd']"
2793,2005,A Bayes Rule for Density Matrices,,['Manfred K. Warmuth']
2794,2005,Structured Prediction via the Extragradient Method,,"['Michael I. Jordan', 'Ben Taskar', 'Simon Lacoste-Julien']"
2795,2005,Distance Metric Learning for Large Margin Nearest Neighbor Classification,,"['Lawrence K. Saul', 'John Blitzer', 'Kilian Q. Weinberger']"
2796,2005,Efficient Unsupervised Learning for Localization and Detection in Object Categories,,"['David Forsyth', 'Nicolas Loeff', 'Himanshu Arora', 'Alexander Sorokin']"
2797,2005,Products of ``Edge-perts,,"['Max Welling', 'Peter V. Gehler']"
2798,2005,Worst-Case Bounds for Gaussian Process Models,,"['Sham M. Kakade', 'Matthias W. Seeger', 'Dean P. Foster']"
2799,2005,Identifying Distributed Object Representations in Human Extrastriate Visual Cortex,,"['Rory Sayres', 'David Ress', 'Kalanit Grill-spector']"
28,1987,On Tropistic Processing and Its Applications,,['Manuel F. Fern?ndez']
280,1989,Generalized Hopfield Networks and Nonlinear Optimization,,"['Manoel Fernando Tenorio', 'Gintaras V. Reklaitis', 'Athanasios G. Tsirukis']"
2800,2005,Convex Neural Networks,,"['Yoshua Bengio', 'Pascal Vincent', 'Olivier Delalleau', 'Nicolas L. Roux', 'Patrice Marcotte']"
2801,2005,Rate Distortion Codes in Sensor Networks: A System-level Analysis,,"['Tatsuto Murayama', 'Peter Davis']"
2802,2005,Optimal cue selection strategy,,"['Laurent Itti', 'Vidhya Navalpakkam']"
2803,2005,An aVLSI Cricket Ear Model,,"['Andre V. Schaik', 'Richard Reeve', 'Craig Jin', 'Tara Hamilton']"
2804,2005,Learning Rankings via Convex Hull Separation,,"['R?mer Rosales', 'Balaji Krishnapuram', 'Glenn Fung']"
2805,2005,The Role of Top-down and Bottom-up Processes in Guiding Eye Movements during Visual Search,,"['Gregory Zelinsky', 'Wei Zhang', 'Bing Yu', 'Xin Chen', 'Dimitris Samaras']"
2806,2005,The Forgetron: A Kernel-Based Perceptron on a Fixed Budget,,"['Yoram Singer', 'Ofer Dekel', 'Shai Shalev-shwartz']"
2807,2005,Ideal Observers for Detecting Motion: Correspondence Noise,,"['Alan L. Yuille', 'Hongjing Lu']"
2808,2005,Rodeo: Sparse Nonparametric Regression in High Dimensions,,"['John D. Lafferty', 'Larry Wasserman']"
2809,2005,Augmented Rescorla-Wagner and Maximum Likelihood Estimation,,['Alan L. Yuille']
281,1989,An Efficient Implementation of the Back-propagation Algorithm on the Connection Machine CM-2,,"['Xiru Zhang', 'Michael McKenna', 'Jill P. Mesirov', 'David L. Waltz']"
2810,2005,The Curse of Highly Variable Functions for Local Kernel Machines,,"['Yoshua Bengio', 'Olivier Delalleau', 'Nicolas L. Roux']"
2811,2005,Inference with Minimal Communication: a Decision-Theoretic Variational Approach,,"['Alan S. Willsky', 'O. P. Kreidl']"
2812,2005,Gradient Flow Independent Component Analysis in Micropower VLSI,,"['Gert Cauwenberghs', 'Abdullah Celik', 'Milutin Stanacevic']"
2813,2005,On the Accuracy of Bounded Rationality: How Far from Optimal Is Fast and Frugal?,,"['Laura Martignon', 'Michael Schmitt']"
2814,2005,Cue Integration for Figure/Ground Labeling,,"['Jitendra Malik', 'Charless C. Fowlkes', 'Xiaofeng Ren']"
2815,2005,Bayesian models of human action understanding,,"['Joshua B. Tenenbaum', 'Chris Baker', 'Rebecca Saxe']"
2816,2005,Sequence and Tree Kernels with Statistical Feature Mining,,"['Jun Suzuki', 'Hideki Isozaki']"
2817,2005,Bayesian Sets,,"['Zoubin Ghahramani', 'Katherine A. Heller']"
2818,2005,A Domain Decomposition Method for Fast Manifold Learning,,"['Hongyuan Zha', 'Zhenyue Zhang']"
2819,2005,A Bayesian Spatial Scan Statistic,,"['Andrew W. Moore', 'Gregory F. Cooper', 'Daniel B. Neill']"
282,1989,Sigma-Pi Learning: On Radial Basis Functions and Cortical Associative Learning,,"['Christof Koch', 'Bartlett W. Mel']"
2820,2005,Group and Topic Discovery from Relations and Their Attributes,,"['Andrew McCallum', 'Xuerui Wang', 'Natasha Mohanty']"
2821,2005,Generalization to Unseen Cases,,"['Teemu Roos', 'Peter Gr?nwald', 'Petri Myllym?ki', 'Henry Tirri']"
2822,2005,Bayesian Surprise Attracts Human Attention,,"['Laurent Itti', 'Pierre F. Baldi']"
2823,2005,Extracting Dynamical Structure Embedded in Neural Activity,,"['Maneesh Sahani', 'Byron M. Yu', 'Afsheen Afshar', 'Gopal Santhanam', 'Stephen I. Ryu', 'Krishna V. Shenoy']"
2824,2005,A Criterion for the Convergence of Learning with Spike Timing Dependent Plasticity,,"['Wolfgang Maass', 'Robert A. Legenstein']"
2825,2005,Fast Online Policy Gradient Learning with SMD Gain Vector Adaptation,,"['Nicol N. Schraudolph', 'Douglas Aberdeen', 'Jin Yu']"
2826,2005,Temporal Abstraction in Temporal-difference Networks,,"['Richard S. Sutton', 'Anna Koop', 'Eddie Rafols']"
2827,2005,"Learning vehicular dynamics, with application to modeling helicopters",,"['Andrew Y. Ng', 'Pieter Abbeel', 'Varun Ganapathi']"
2828,2005,Asymptotics of Gaussian Regularized Least Squares,,"['Ross Lippert', 'Ryan Rifkin']"
2829,2005,"Two view learning: SVM-2K, Theory and Practice",,"['John S. Shawe-taylor', 'Jason Farquhar', 'David Hardoon', 'Hongying Meng', 'S?ndor Szedm?k']"
283,1989,Operational Fault Tolerance of CMAC Networks,,"['Michael J. Carter', 'Franklin J. Rudolph', 'Adam J. Nucci']"
2830,2005,Saliency Based on Information Maximization,,"['Neil Bruce', 'John Tsotsos']"
2831,2005,Faster Rates in Regression via Active Learning,,"['Robert Nowak', 'Rebecca Willett', 'Rui M. Castro']"
2832,2005,Layered Dynamic Textures,,"['Nuno Vasconcelos', 'Antoni B. Chan']"
2833,2005,Walk-Sum Interpretation and Analysis of Gaussian Belief Propagation,,"['Alan S. Willsky', 'Dmitry Malioutov', 'Jason K. Johnson']"
2834,2005,Cyclic Equilibria in Markov Games,,"['Michael L. Littman', 'Martin Zinkevich', 'Amy Greenwald']"
2835,2005,Fast Gaussian Process Regression using KD-Trees,,"['Andrew Y. Ng', 'Matthias Seeger', 'Yirong Shen']"
2836,2005,Optimizing spatio-temporal filters for improving Brain-Computer Interfacing,,"['Klaus-Robert M?ller', 'Benjamin Blankertz', 'Gabriel Curio', 'Guido Dornhege', 'Matthias Krauledat', 'Florian Losch']"
2837,2005,An Application of Markov Random Fields to Range Sensing,,"['Sebastian Thrun', 'James Diebel']"
2838,2005,Pattern Recognition from One Example by Chopping,,"['Gilles Blanchard', 'Francois Fleuret']"
2839,2005,Improved risk tail bounds for on-line algorithms,,"['Claudio Gentile', 'Nicol? Cesa-bianchi']"
284,1989,A Neural Network for Real-Time Signal Processing,,['Donald B. Malkoff']
2840,2005,Active Bidirectional Coupling in a Cochlear Chip,,"['Kwabena A. Boahen', 'Bo Wen']"
2841,2005,Predicting EMG Data from M1 Neurons with Variational Bayesian Least Squares,,"['Mitsuo Kawato', 'John Kalaska', 'Jo-anne Ting', ""Aaron D'souza"", 'Kenji Yamamoto', 'Toshinori Yoshioka', 'Donna Hoffman', 'Shinji Kakei', 'Lauren Sergio']"
2842,2005,"How fast to work: Response vigor, motivation and tonic dopamine",,"['Peter Dayan', 'Nathaniel D. Daw', 'Yael Niv']"
2843,2005,Transfer learning for text classification,,"['Chuong B. Do', 'Andrew Y. Ng']"
2844,2005,A PAC-Bayes approach to the Set Covering Machine,,"['Mario Marchand', 'Mohak Shah', 'Fran?ois Laviolette']"
2845,2005,Response Analysis of Neuronal Population with Synaptic Depression,,"['Wentao Huang', 'Licheng Jiao', 'Shan Tan', 'Maoguo Gong']"
2846,2005,Benchmarking Non-Parametric Statistical Tests,,"['Samy Bengio', 'Mikaela Keller', 'Siew Y. Wong']"
2847,2005,Off-Road Obstacle Avoidance through End-to-End Learning,,"['Jan Ben', 'Eric Cosatto', 'Yann L. Cun', 'Urs Muller', 'Beat Flepp']"
2848,2005,Nearest Neighbor Based Feature Selection for Regression and its Application to Neural Activity,,"['Eilon Vaadia', 'Naftali Tishby', 'Lavi Shpigelman', 'Amir Navot']"
2849,2005,Phase Synchrony Rate for the Recognition of Motor Imagery in Brain-Computer Interface,,"['Le Song', 'Evian Gordon', 'Elly Gysels']"
285,1989,Collective Oscillations in the Visual Cortex,,"['Christof Koch', 'Daniel M. Kammen', 'Philip J. Holmes']"
2850,2005,Maximum Margin Semi-Supervised Learning for Structured Variables,,"['Y. Altun', 'D. McAllester', 'M. Belkin']"
2851,2005,Learning Minimum Volume Sets,,"['Clayton Scott', 'Robert Nowak']"
2852,2005,Spiking Inputs to a Winner-take-all Network,,"['Matthias Oster', 'Shih-Chii Liu']"
2853,2005,Separation of Music Signals by Harmonic Structure Modeling,,"['Yun-gang Zhang', 'Chang-shui Zhang']"
2854,2005,Non-Gaussian Component Analysis: a Semi-parametric Framework for Linear Dimension Reduction,,"['Klaus-Robert M?ller', 'Masashi Sugiyama', 'Motoaki Kawanabe', 'Gilles Blanchard', 'Vladimir Spokoiny']"
2855,2005,Modeling Neuronal Interactivity using Dynamic Bayesian Networks,,"['Dimitris Samaras', 'Lei Zhang', 'Nelly Alia-klein', 'Nora Volkow', 'Rita Goldstein']"
2856,2005,Computing the Solution Path for the Regularized Support Vector Regression,,"['Ji Zhu', 'Lacey Gunter']"
2857,2005,Sparse Gaussian Processes using Pseudo-inputs,,"['Zoubin Ghahramani', 'Edward Snelson']"
2858,2005,Integrate-and-Fire models with adaptation are good enough,,"['Wulfram Gerstner', 'Renaud Jolivet', 'Alexander Rauch', 'Hans-rudolf L?scher']"
2859,2005,Learning in Silicon: Timing is Everything,,"['Kwabena Boahen', 'John V. Arthur']"
286,1989,Neural Network Visualization,,"['Gerald Tesauro', 'Jakub Wejchert']"
2860,2005,Generalization error bounds for classifiers trained with interdependent data,,"['Patrick Gallinari', 'Nicolas Usunier', 'Massih-reza Amini']"
2861,2005,Kernels for gene regulatory regions,,"['William S. Noble', 'Jean-philippe Vert', 'Robert Thurman']"
2862,2005,A matching pursuit approach to sparse Gaussian process regression,,"['Sathiya Keerthi', 'Wei Chu']"
2863,2005,From Lasso regression to Feature vector machine,,"['Eric P. Xing', 'Yiming Yang', 'Fan Li']"
2864,2005,Principles of real-time computing with feedback applied to cortical microcircuit models,,"['Wolfgang Maass', 'Eduardo D. Sontag', 'Prashant Joshi']"
2865,2005,Fast Krylov Methods for N-Body Learning,,"['Nando D. Freitas', 'Dustin Lang', 'Yang Wang', 'Maryam Mahdaviani']"
2866,2005,Conditional Visual Tracking in Kernel Space,,"['Cristian Sminchisescu', 'Atul Kanujia', 'Zhiguo Li', 'Dimitris Metaxas']"
2867,2005,A Theoretical Analysis of Robust Coding over Noisy Overcomplete Channels,,"['Michael S. Lewicki', 'Eizaburo Doi', 'Doru C. Balcan']"
2868,2005,Bayesian model learning in human visual perception,,"['M?t? Lengyel', 'Gerg? Orb?n', 'Jozsef Fiser', 'Richard N. Aslin']"
2869,2005,Beyond Gaussian Processes: On the Distributions of Infinite Networks,,"['Daniel D. Lee', 'Ricky Der']"
287,1989,Neural Network Simulation of Somatosensory Representational Plasticity,,"['Kamil A. Grajski', 'Michael Merzenich']"
2870,2005,Mixture Modeling by Affinity Propagation,,"['Brendan J. Frey', 'Delbert Dueck']"
2871,2005,Value Function Approximation with Diffusion Wavelets and Laplacian Eigenfunctions,,"['Sridhar Mahadevan', 'Mauro Maggioni']"
2872,2005,Efficient Estimation of OOMs,,"['Herbert Jaeger', 'Mingjie Zhao', 'Andreas Kolling']"
2873,2005,Modeling Memory Transfer and Saving in Cerebellar Motor Learning,,"['Shun-ichi Amari', 'Naoki Masuda']"
2874,2005,Noise and the two-thirds power Law,,"['Tamar Flash', 'Yair Weiss', 'Uri Maoz', 'Elon Portugaly']"
2875,2005,Top-Down Control of Visual Attention: A Rational Account,,"['Michael C. Mozer', 'Michael Shettel', 'Shaun Vecera']"
2876,2005,Measuring Shared Information and Coordinated Activity in Neuronal Networks,,"['Kristina Klinkner', 'Cosma Shalizi', 'Marcelo Camperi']"
2877,2005,TD(0) Leads to Better Policies than Approximate Value Iteration,,['Benjamin V. Roy']
2878,2005,An Approximate Inference Approach for the PCA Reconstruction Error,,['Manfred Opper']
2879,2005,Dynamic Social Network Analysis using Latent Space Models,,"['Andrew W. Moore', 'Purnamrita Sarkar']"
288,1989,Analytic Solutions to the Formation of Feature-Analysing Cells of a Three-Layer Feedforward Visual Information Processing Neural Net,,['Dun-Sung Tang']
2880,2005,Fusion of Similarity Data in Clustering,,"['Joachim M. Buhmann', 'Tilman Lange']"
2881,2005,Large-Scale Multiclass Transduction,,"['Thomas G?rtner', 'Quoc V. Le', 'Simon Burton', 'Alex J. Smola', 'Vishy Vishwanathan']"
2882,2005,Infinite latent feature models and the Indian buffet process,,"['Zoubin Ghahramani', 'Thomas L. Griffiths']"
2883,2005,Online Discovery and Learning of Predictive State Representations,,"['Michael Bowling', 'Peter Mccracken']"
2884,2005,Selecting Landmark Points for Sparse Manifold Learning,,"['Jorge Silva', 'Jorge Marques', 'Jo?o Lemos']"
2885,2005,Neural mechanisms of contrast dependent receptive field size in V1,,"['Paul Sajda', 'Jim Wielaard']"
2886,2005,Efficient estimation of hidden state dynamics from spike trains,,"['Richard H. R. Hahnloser', 'Marton G. Danoczy']"
2887,2005,Context as Filtering,,"['Yuji Matsumoto', 'Daichi Mochihashi']"
2888,2005,Large-scale biophysical parameter estimation in single neurons via constrained linear regression,,"['Liam Paninski', 'Quentin J. Huys', 'Misha Ahrens']"
2889,2005,AER Building Blocks for Multi-Layer Multi-Chip Neuromorphic Vision Systems,,"['R. Serrano-Gotarredona', 'M. Oster', 'P. Lichtsteiner', 'A. Linares-Barranco', 'R. Paz-Vicente', 'F. Gomez-Rodriguez', 'H. Kolle Riis', 'T. Delbruck', 'S. C. Liu', 'S. Zahnd', 'A. M. Whatley', 'R. Douglas', 'P. Hafliger', 'G. Jimenez-Moreno', 'A. Civit', 'T. Serrano-Gotarredona', 'A. Acosta-Jimenez', 'B. Linares-Barranco']"
289,1989,Using Local Models to Control Movement,,['Christopher G. Atkeson']
2890,2005,A General and Efficient Multiple Kernel Learning Algorithm,,"['Gunnar R?tsch', 'S?ren Sonnenburg', 'Christin Sch?fer']"
2891,2005,Statistical Convergence of Kernel CCA,,"['Kenji Fukumizu', 'Francis R. Bach', 'Arthur Gretton']"
2892,2005,Logic and MRF Circuitry for Labeling Occluding and Thinline Visual Contours,,['Eric Saund']
2893,2005,Analyzing Auditory Neurons by Learning Distance Functions,,"['Daphna Weinshall', 'Israel Nelken', 'Tomer Hertz', 'Inna Weiner']"
2894,2005,Visual Encoding with Jittering Eyes,,['Michele Rucci']
2895,2005,Using ``epitomes'' to model genetic diversity: Rational design of HIV vaccine cocktails,,"['Brendan J. Frey', 'Nebojsa Jojic', 'Vladimir Jojic', 'Christopher Meek', 'David Heckerman']"
2896,2005,Generalization in Clustering with Unobserved Features,,"['Naftali Tishby', 'Eyal Krupka']"
2897,2005,Unbiased Estimator of Shape Parameter for Spiking Irregularities under Changing Environments,,"['Shun-ichi Amari', 'Masato Okada', 'Keiji Miura']"
2898,2005,Fast Information Value for Graphical Models,,"['Andrew W. Moore', 'Brigham S. Anderson']"
2899,2005,Tensor Subspace Analysis,,"['Partha Niyogi', 'Xiaofei He', 'Deng Cai']"
29,1987,Basins of Attraction for Electronic Neural Networks,,"['Charles M. Marcus', 'R. M. Westervelt']"
290,1989,Combining Visual and Acoustic Speech Signals with a Neural Network Improves Intelligibility,,"['Terrence J. Sejnowski', 'Ben P. Yuhas', 'Moise H. Goldstein Jr.', 'Robert E. Jenkins']"
2900,2005,Nonparametric inference of prior probabilities from Bayes-optimal behavior,,['Liam Paninski']
2901,2005,Is Early Vision Optimized for Extracting Higher-order Dependencies?,,"['Michael S. Lewicki', 'Yan Karklin']"
2902,2005,Size Regularized Cut for Data Clustering,,"['Yixin Chen', 'Ya Zhang', 'Xiang Ji']"
2903,2005,Assessing Approximations for Gaussian Process Classification,,"['Carl E. Rasmussen', 'Malte Kuss']"
2904,2005,Hierarchical Linear/Constant Time SLAM Using Particle Filters for Dense Maps,,"['Ronald Parr', 'Austin I. Eliazar']"
2905,2005,"Divergences, surrogate loss functions and experimental design",,"['Michael I. Jordan', 'XuanLong Nguyen', 'Martin J. Wainwright']"
2906,2005,Correlated Topic Models,,"['John D. Lafferty', 'David M. Blei']"
2907,2005,Radial Basis Function Network for Multi-task Learning,,"['Lawrence Carin', 'Xuejun Liao']"
2908,2005,Non-iterative Estimation with Perturbed Gaussian Markov Processes,,"['Yunsong Huang', 'B. Keith Jenkins']"
2909,2005,Laplacian Score for Feature Selection,,"['Partha Niyogi', 'Xiaofei He', 'Deng Cai']"
291,1989,Dataflow Architectures: Flexible Platforms for Neural Network Simulation,,['Ira Smotroff']
2910,2005,Policy-Gradient Methods for Planning,,['Douglas Aberdeen']
2911,2005,Location-based activity recognition,,"['Dieter Fox', 'Lin Liao', 'Henry Kautz']"
2912,2005,Sensory Adaptation within a Bayesian Framework for Perception,,"['Eero P. Simoncelli', 'Alan A. Stocker']"
2913,2005,Consensus Propagation,,"['Benjamin V. Roy', 'Ciamac C. Moallemi']"
2914,2005,Non-Local Manifold Parzen Windows,,"['Yoshua Bengio', 'Pascal Vincent', 'Hugo Larochelle']"
2915,2005,Variable KD-Tree Algorithms for Spatial Pattern Search and Discovery,,"['Andrew W. Moore', 'Jeremy Kubica', 'Joseph Masiero', 'Robert Jedicke', 'Andrew Connolly']"
2916,2005,Query by Committee Made Real,,"['Naftali Tishby', 'Ran Gilad-bachrach', 'Amir Navot']"
2917,2005,Neuronal Fiber Delineation in Area of Edema from Diffusion Weighted MRI,,"['Nathan Intrator', 'Ofer Pasternak', 'Nir Sochen', 'Yaniv Assaf']"
2918,2005,Learning Influence among Interacting Markov Chains,,"['Samy Bengio', 'Dong Zhang', 'Daniel Gatica-perez', 'Deb Roy']"
2919,2005,Searching for Character Models,,"['Jaety Edwards', 'David Forsyth']"
292,1989,Discovering the Structure of a Reactive Environment by Exploration,,"['Michael C. Mozer', 'Jonathan Bachrach']"
2920,2005,Learning from Data of Variable Quality,,"['Michael Kearns', 'Koby Crammer', 'Jennifer Wortman']"
2921,2005,Learning Depth from Single Monocular Images,,"['Andrew Y. Ng', 'Ashutosh Saxena', 'Sung H. Chung']"
2922,2005,Learning Topology with the Generative Gaussian Graph and the EM Algorithm,,['Micha?l Aupetit']
2923,2005,Beyond Pair-Based STDP: a Phenomenological Rule for Spike Triplet and Frequency Effects,,"['Wulfram Gerstner', 'Jean-pascal Pfister']"
2924,2005,Robust design of biological experiments,,"['Michael I. Jordan', 'Patrick Flaherty', 'Adam Arkin']"
2925,2005,Estimating the wrong Markov random field: Benefits in the computation-limited setting,,['Martin J. Wainwright']
2926,2005,Multiple Instance Boosting for Object Detection,,"['John C. Platt', 'Paul A. Viola', 'Cha Zhang']"
2927,2005,Scaling Laws in Natural Scenes and the Inference of 3D Shape,,"['Tai-sing Lee', 'Brian R. Potetz']"
2928,2005,Dual-Tree Fast Gauss Transforms,,"['Andrew W. Moore', 'Alexander G. Gray', 'Dongryeol Lee']"
2929,2005,Correcting sample selection bias in maximum entropy density estimation,,"['Robert E. Schapire', 'Miroslav Dud?k', 'Steven J. Phillips']"
293,1989,Handwritten Digit Recognition with a Back-Propagation Network,,"['John S. Denker', 'Donnie Henderson', 'R. E. Howard', 'Wayne E. Hubbard', 'Yann LeCun', 'Bernhard E. Boser', 'Lawrence D. Jackel']"
2930,2005,An Analog Visual Pre-Processing Processor Employing Cyclic Line Access in Only-Nearest-Neighbor-Interconnects Architecture,,"['Tadashi Shibata', 'Yusuke Nakashita', 'Yoshio Mita']"
2931,2005,A Connectionist Model for Constructive Modal Reasoning,,"['Artur Garcez', 'Luis C. Lamb', 'Dov M. Gabbay']"
2932,2005,Hyperparameter and Kernel Learning for Graph Based Semi-Supervised Classification,,"['Yuan Qi', 'Ashish Kapoor', 'Hyungil Ahn', 'Rosalind W. Picard']"
2933,2005,Variational EM Algorithms for Non-Gaussian Latent Variable Models,,"['Kenneth Kreutz-Delgado', 'Jason Palmer', 'Bhaskar D. Rao', 'David P. Wipf']"
2934,2005,Kernelized Infomax Clustering,,"['David Barber', 'Felix V. Agakov']"
2935,2005,Variational Bayesian Stochastic Complexity of Mixture Models,,"['Sumio Watanabe', 'Kazuho Watanabe']"
2936,2005,A Cortically-Plausible Inverse Problem Solving Method Applied to Recognizing Static and Kinematic 3D Objects,,['David Arathorn']
2937,2005,Inferring Motor Programs from Images of Handwritten Digits,,"['Geoffrey E. Hinton', 'Vinod Nair']"
2938,2005,Combining Graph Laplacians for Semi--Supervised Learning,,"['Mark Herbster', 'Massimiliano Pontil', 'Andreas Argyriou']"
2939,2005,Learning Cue-Invariant Visual Responses,,['Jarmo Hurri']
294,1990,Generalization Properties of Radial Basis Functions,,"['Christopher G. Atkeson', 'Sherif M. Botros']"
2940,2005,Active Learning For Identifying Function Threshold Boundaries,,"['Brent Bryan', 'Robert C. Nichol', 'Christopher R. Genovese', 'Jeff Schneider', 'Christopher J. Miller', 'Larry Wasserman']"
2941,2005,Interpolating between types and tokens by estimating power-law generators,,"['Thomas L. Griffiths', 'Mark Johnson', 'Sharon Goldwater']"
2942,2005,"Diffusion Maps, Spectral Clustering and Eigenfunctions of Fokker-Planck Operators",,"['Boaz Nadler', 'Stephane Lafon', 'Ioannis Kevrekidis', 'Ronald R. Coifman']"
2943,2005,Coarse sample complexity bounds for active learning,,['Sanjoy Dasgupta']
2944,2005,Active Learning for Misspecified Models,,['Masashi Sugiyama']
2945,2005,Estimation of Intrinsic Dimensionality Using High-Rate Vector Quantization,,"['Maxim Raginsky', 'Svetlana Lazebnik']"
2946,2005,Prediction and Change Detection,,"['Mark Steyvers', 'Scott Brown']"
2947,2005,Metric Learning by Collapsing Classes,,"['Sam T. Roweis', 'Amir Globerson']"
2948,2005,Soft Clustering on Graphs,,"['Volker Tresp', 'Kai Yu', 'Shipeng Yu']"
2949,2005,A Computational Model of Eye Movements during Object Class Detection,,"['Gregory J. Zelinsky', 'Wei Zhang', 'Dimitris Samaras', 'Hyejin Yang']"
295,1990,Spoken Letter Recognition,,"['Mark Fanty', 'Ronald Cole']"
2950,2005,An exploration-exploitation model based on norepinepherine and dopamine activity,,"['Jonathan D. Cohen', 'Samuel M. McClure', 'Mark S. Gilzenrat']"
2951,2005,On Local Rewards and Scaling Distributed Reinforcement Learning,,"['Andrew Y. Ng', 'Drew Bagnell']"
2952,2005,A Probabilistic Approach for Optimizing Spectral Clustering,,"['Rong Jin', 'Feng Kang', 'Chris H. Ding']"
2953,2005,Preconditioner Approximations for Probabilistic Graphical Models,,"['John D. Lafferty', 'Pradeep K. Ravikumar']"
2954,2005,Message passing for task redistribution on sparse graphs,,"['David Saad', 'K. Y. Michael Wong', 'Zhuo Gao']"
2955,2005,CMOL CrossNets: Possible Neuromorphic Nanoelectronic Circuits,,"['Jung Hoon Lee', 'Xiaolong Ma', 'Konstantin K. Likharev']"
2956,2005,Goal-Based Imitation as Probabilistic Inference over Graphical Models,,"['Rajesh P. Rao', 'Deepak Verma']"
2957,2006,Learning Dense 3D Correspondence,,"['Bernhard Sch?lkopf', 'Florian Steinke', 'Volker Blanz']"
2958,2006,Effects of Stress and Genotype on Meta-parameter Dynamics in Reinforcement Learning,,"['Wulfram Gerstner', 'Gediminas Luk?ys', 'J?r?mie Kn?sel', 'Denis Sheynikhovich', 'Carmen Sandi']"
2959,2006,PAC-Bayes Bounds for the Risk of the Majority Vote and the Variance of the Gibbs Classifier,,"['Mario Marchand', 'Fran?ois Laviolette', 'Nicolas Usunier', 'Pascal Germain', 'Alexandre Lacasse']"
296,1990,How Receptive Field Parameters Affect Neural Learning,,"['Bartlett W. Mel', 'Stephen M. Omohundro']"
2960,2006,Balanced Graph Matching,,"['Jianbo Shi', 'Praveen Srinivasan', 'Timothee Cour']"
2961,2006,Active learning for misspecified generalized linear models,,['Francis R. Bach']
