id,year,title,event_type,authors
5855,2015,A Reduced-Dimension fMRI Shared Response Model,Oral,"['James Haxby', 'Peter J. Ramadge', 'Uri Hasson', 'Po-Hsuan (Cameron) Chen', 'Janice Chen', 'Yaara Yeshurun']"
5856,2015,Attractor Network Dynamics Enable Preplay and Rapid Path Planning in Maze?like Environments,Oral,"['Wulfram Gerstner', 'Dane S. Corneil']"
5857,2015,Inferring Algorithmic Patterns with Stack-Augmented Recurrent Nets,Spotlight,"['Armand Joulin', 'Tomas Mikolov']"
5858,2015,Decoupled Deep Neural Network for Semi-supervised Semantic Segmentation,Spotlight,"['Bohyung Han', 'Seunghoon Hong', 'Hyeonwoo Noh']"
5859,2015,Action-Conditional Video Prediction using Deep Networks in Atari Games,Spotlight,"['Honglak Lee', 'Richard L. Lewis', 'Xiaoxiao Guo', 'Satinder Singh', 'Junhyuk Oh']"
586,1991,ANN Based Classification for Heart Defibrillators,,"['M. Jabri', 'S. Pickard', 'P. Leong', 'Z. Chi', 'B. Flower', 'Y. Xie']"
5860,2015,On-the-Job Learning with Bayesian Decision Theory,Spotlight,"['Christopher D. Manning', 'Percy S. Liang', 'Arun Tejasvi Chaganty', 'Keenon Werling']"
5861,2015,Learning Wake-Sleep Recurrent Attention Models,Spotlight,"['Brendan J. Frey', 'Ruslan R. Salakhutdinov', 'Roger B. Grosse', 'Jimmy Ba']"
5862,2015,Backpropagation for Energy-Efficient Neuromorphic Computing,Spotlight,"['Paul Merolla', 'John V. Arthur', 'Steve K. Esser', 'Rathinakumar Appuswamy', 'Dharmendra S. Modha']"
5863,2015,A Tractable Approximation to Optimal Point Process Filtering: Application to Neural Encoding,Spotlight,"['Manfred Opper', 'Ron Meir', 'Yuval Harel']"
5864,2015,Color Constancy by Learning to Predict Chromaticity from Luminance,Spotlight,['Ayan Chakrabarti']
5865,2015,Efficient Exact Gradient Update for training Deep Networks with Very Large Sparse Targets,Oral,"['Pascal Vincent', 'Alexandre de Br?bisson', 'Xavier Bouthillier']"
5866,2015,Pointer Networks,Spotlight,"['Oriol Vinyals', 'Navdeep Jaitly', 'Meire Fortunato']"
5867,2015,Precision-Recall-Gain Curves: PR Analysis Done Right,Spotlight,"['Peter Flach', 'Meelis Kull']"
5868,2015,"NEXT: A System for Real-World Development, Evaluation, and Application of Active Learning",Spotlight,"['Kevin G. Jamieson', 'Rob Nowak', 'Lalit Jain', 'Chris Fernandez', 'Nicholas J. Glattard']"
5869,2015,Structured Transforms for Small-Footprint Deep Learning,Spotlight,"['Sanjiv Kumar', 'Vikas Sindhwani', 'Tara Sainath']"
587,1992,Using Prior Knowledge in a NNPDA to Learn Context-Free Languages,,"['C. Lee Giles', 'Guo-Zheng Sun', 'Sreerupa Das']"
5870,2015,Equilibrated adaptive learning rates for non-convex optimization,Spotlight,"['Yoshua Bengio', 'Yann Dauphin', 'Harm de Vries']"
5871,2015,Bayesian Active Model Selection with an Application to Automated Audiometry,Poster,"['Kilian Q. Weinberger', 'John P. Cunningham', 'Roman Garnett', 'Gustavo Malkomes', 'Jacob Gardner', 'Dennis Barbour']"
5872,2015,Efficient and Robust Automated Machine Learning,Poster,"['Jost Springenberg', 'Matthias Feurer', 'Aaron Klein', 'Katharina Eggensperger', 'Manuel Blum', 'Frank Hutter']"
5873,2015,A Framework for Individualizing Predictions of Disease Trajectories by Exploiting Multi-Resolution Structure,Poster,"['Peter Schulam', 'Suchi Saria']"
5874,2015,Gaussian Process Random Fields,Poster,"['Stuart J. Russell', 'David Moore']"
5875,2015,MCMC for Variationally Sparse Gaussian Processes,Poster,"['Zoubin Ghahramani', 'James Hensman', 'Alexander G. Matthews', 'Maurizio Filippone']"
5876,2015,"Streaming, Distributed Variational Inference for Bayesian Nonparametrics",Poster,"['John W. Fisher III', 'Trevor Campbell', 'Jonathan P. How', 'Julian Straub']"
5877,2015,Fixed-Length Poisson MRF: Adding Dependencies to the Multinomial,Poster,"['Pradeep K. Ravikumar', 'Inderjit S. Dhillon', 'David I. Inouye']"
5878,2015,Human Memory Search as Initial-Visit Emitting Random Walk,Poster,"['Xiaojin Zhu', 'Timothy T. Rogers', 'Kwang-Sung Jun', 'Zhuoran Yang', 'ming yuan']"
5879,2015,Spectral Learning of Large Structured HMMs for Comparative Epigenomics,Poster,"['Kamalika Chaudhuri', 'Chicheng Zhang', 'Jimin Song', 'Kevin Chen']"
588,1992,An Analog VLSI Chip for Radial Basis Functions,,"['John C. Platt', 'Janeen Anderson', 'David B. Kirk']"
5880,2015,A Structural Smoothing Framework For Robust Graph Comparison,Poster,"['Pinar Yanardag', 'S.V.N. Vishwanathan']"
5881,2015,Optimization Monte Carlo: Efficient and Embarrassingly Parallel Likelihood-Free Inference,Poster,"['Max Welling', 'Ted Meeds']"
5882,2015,Inverse Reinforcement Learning with Locally Consistent Reward Functions,Poster,"['Patrick Jaillet', 'Quoc Phong Nguyen', 'Bryan Kian Hsiang Low']"
5883,2015,Consistent Multilabel Classification,Poster,"['Pradeep K. Ravikumar', 'Inderjit S. Dhillon', 'Nagarajan Natarajan', 'Oluwasanmi O. Koyejo']"
5884,2015,Is Approval Voting Optimal Given Approval Votes?,Poster,"['Ariel D. Procaccia', 'Nisarg Shah']"
5885,2015,A Normative Theory of Adaptive Dimensionality Reduction in Neural Networks,Poster,"['Cengiz Pehlevan', 'Dmitri Chklovskii']"
5886,2015,Efficient Non-greedy Optimization of Decision Trees,Poster,"['Pushmeet Kohli', 'Mohammad Norouzi', 'David J. Fleet', 'Maxwell Collins', 'Matthew A. Johnson']"
5887,2015,Statistical Topological Data Analysis - A Kernel Perspective,Poster,"['Roland Kwitt', 'Stefan Huber', 'Marc Niethammer', 'Weili Lin', 'Ulrich Bauer']"
5888,2015,Variational Consensus Monte Carlo,Poster,"['Michael I. Jordan', 'Maxim Rabinovich', 'Elaine Angelino']"
5889,2015,Softstar: Heuristic-Guided Probabilistic Inference,Poster,"['Josh Tenenbaum', 'Brenden M. Lake', 'Brenden M. Lake', 'Brian Ziebart', 'Mathew Monfort', 'Patrick Lucey']"
589,1992,Automatic Learning Rate Maximization by On-Line Estimation of the Hessian's Eigenvectors,,"['Patrice Y. Simard', 'Yann LeCun', 'Barak Pearlmutter']"
5890,2015,Gradient-free Hamiltonian Monte Carlo with Efficient Kernel Exponential Families,Poster,"['Arthur Gretton', 'Dino Sejdinovic', 'Heiko Strathmann', 'Zoltan Szabo', 'Samuel Livingstone']"
5891,2015,A Complete Recipe for Stochastic Gradient MCMC,Poster,"['Emily Fox', 'Yi-An Ma', 'Tianqi Chen']"
5892,2015,Barrier Frank-Wolfe for Marginal Inference,Poster,"['Simon Lacoste-Julien', 'David Sontag', 'Rahul G. Krishnan']"
5893,2015,Practical and Optimal LSH for Angular Distance,Poster,"['Alexandr Andoni', 'Piotr Indyk', 'Thijs Laarhoven', 'Ilya Razenshteyn', 'Ludwig Schmidt']"
5894,2015,Principal Differences Analysis: Interpretable Characterization of Differences between Distributions,Poster,"['Tommi Jaakkola', 'Jonas W. Mueller']"
5895,2015,Kullback-Leibler Proximal Variational Inference,Poster,"['Mohammad E. Khan', 'Pascal Fua', 'Fran?ois Fleuret', 'Pierre Baque']"
5896,2015,Learning Large-Scale Poisson DAG Models based on OverDispersion Scoring,Poster,"['Garvesh Raskutti', 'Gunwoong Park']"
5897,2015,Streaming Min-max Hypergraph Partitioning,Poster,"['Milan Vojnovic', 'Dan Alistarh', 'Jennifer Iglesias']"
5898,2015,Efficient Output Kernel Learning for Multiple Tasks,Poster,"['Matthias Hein', 'Bernt Schiele', 'Maksim Lapin', 'Pratik Jawanpuria']"
5899,2015,Gradient Estimation Using Stochastic Computation Graphs,Poster,"['Pieter Abbeel', 'Nicolas Heess', 'John Schulman', 'Theophane Weber']"
59,1987,How Neural Nets Work,,"['Alan S. Lapedes', 'Robert M. Farber']"
590,1992,Computing with Almost Optimal Size Neural Networks,,"['Thomas Kailath', 'Kai-Yeung Siu', 'Vwani Roychowdhury']"
5900,2015,Lifted Inference Rules With Constraints,Poster,"['Happy Mittal', 'Vibhav G. Gogate', 'Parag Singla', 'Anuj Mahajan']"
5901,2015,Sparse PCA via Bipartite Matchings,Poster,"['Alexandros G. Dimakis', 'Dimitris Papailiopoulos', 'Megasthenis Asteris', 'Anastasios Kyrillidis']"
5902,2015,"Weighted Theta Functions and Embeddings with Applications to Max-Cut, Clustering and Summarization",Poster,"['Chiranjib Bhattacharyya', 'Devdatt Dubhashi', 'Fredrik D. Johansson', 'Ankani Chattoraj']"
5903,2015,Online Rank Elicitation for Plackett-Luce: A Dueling Bandits Approach,Poster,"['Eyke H?llermeier', 'Bal?zs Sz?r?nyi', 'R?bert Busa-Fekete', 'Adil Paul']"
5904,2015,Segregated Graphs and Marginals of Chain Graph Models,Poster,['Ilya Shpitser']
5905,2015,Approximating Sparse PCA from Incomplete Data,Poster,"['Malik Magdon-Ismail', 'Petros Drineas', 'ABHISEK KUNDU']"
5906,2015,Recovering Communities in the General Stochastic Block Model Without Knowing the Parameters,Poster,"['Emmanuel Abbe', 'Colin Sandon']"
5907,2015,Maximum Likelihood Learning With Arbitrary Treewidth via Fast-Mixing Parameter Sets,Poster,['Justin Domke']
5908,2015,Testing Closeness With Unequal Sized Samples,Poster,"['Gregory Valiant', 'Bhaswar Bhattacharya']"
5909,2015,Learning Causal Graphs with Small Interventions,Poster,"['Karthikeyan Shanmugam', 'Alexandros G. Dimakis', 'Murat Kocaoglu', 'Sriram Vishwanath']"
591,1992,Silicon Auditory Processors as Computer Peripherals,,"['John Lazzaro', 'John Wawrzynek', 'M. Mahowald', 'Massimo Sivilotti', 'Dave Gillespie']"
5910,2015,Regret-Based Pruning in Extensive-Form Games,Poster,"['Tuomas Sandholm', 'Noam Brown']"
5911,2015,"Nonparametric von Mises Estimators for Entropies, Divergences and Mutual Informations",Poster,"['Larry Wasserman', 'Akshay Krishnamurthy', 'Barnabas Poczos', 'Kirthevasan Kandasamy', 'james m. robins']"
5912,2015,Bounding errors of Expectation-Propagation,Poster,"['Guillaume P. Dehaene', 'Simon Barthelm?']"
5913,2015,Local Smoothness in Variance Reduced Optimization,Poster,"['Tong Zhang', 'Han Liu', 'Daniel Vainsencher']"
5914,2015,High Dimensional EM Algorithm: Statistical Optimization and Asymptotic Normality,Poster,"['Han Liu', 'Quanquan Gu', 'Zhaoran Wang', 'Yang Ning']"
5915,2015,Associative Memory via a Sparse Recovery Model,Poster,"['Arya Mazumdar', 'Ankit Singh Rawat']"
5916,2015,Matrix Completion Under Monotonic Single Index Models,Poster,"['Rebecca Willett', 'Ravi Sastry Ganti', 'Laura Balzano']"
5917,2015,Sparse Linear Programming via Primal and Dual Augmented Coordinate Descent,Poster,"['Cho-Jui Hsieh', 'Pradeep K. Ravikumar', 'Inderjit S. Dhillon', 'Ian En-Hsu Yen', 'Kai Zhong']"
5918,2015,Convergence rates of sub-sampled Newton methods,Poster,"['Sham M. Kakade', 'Sujay Sanghavi', 'Kamalika Chaudhuri', 'Praneeth Netrapalli']"
5919,2015,Variance Reduced Stochastic Gradient Descent with Neighbors,Poster,"['Thomas Hofmann', 'Simon Lacoste-Julien', 'Brian McWilliams', 'Aurelien Lucchi']"
592,1992,Predicting Complex Behavior in Sparse Asymmetric Networks,,"['Ali A. Minai', 'William B. Levy']"
5920,2015,Non-convex Statistical Optimization for Sparse Tensor Graphical Model,Poster,"['Han Liu', 'Zhaoran Wang', 'Wei Sun', 'Guang Cheng']"
5921,2015,Convergence Rates of Active Learning for Maximum Likelihood Estimation,Poster,"['Sham M. Kakade', 'Sujay Sanghavi', 'Kamalika Chaudhuri', 'Praneeth Netrapalli']"
5922,2015,When are Kalman-Filter Restless Bandits Indexable?,Poster,"['Tomi Silander', 'Christopher R. Dance']"
5923,2015,Policy Gradient for Coherent Risk Measures,Poster,"['Shie Mannor', 'Mohammad Ghavamzadeh', 'Yinlam Chow', 'Aviv Tamar']"
5924,2015,A Dual Augmented Block Minimization Framework for Learning with Limited Memory,Poster,"['Ian En-Hsu Yen', 'Shou-De Lin', 'Shan-Wei Lin']"
5925,2015,On the Global Linear Convergence of Frank-Wolfe Optimization Variants,Poster,"['Simon Lacoste-Julien', 'Martin Jaggi']"
5926,2015,Quartz: Randomized Dual Coordinate Ascent with Arbitrary Sampling,Poster,"['Tong Zhang', 'Zheng Qu', 'Peter Richtarik']"
5927,2015,A Generalization of Submodular Cover via the Diminishing Return Property on the Integer Lattice,Poster,"['Yuichi Yoshida', 'Tasuku Soma']"
5928,2015,A Universal Catalyst for First-Order Optimization,Poster,"['Julien Mairal', 'Zaid Harchaoui', 'Hongzhou Lin']"
5929,2015,Fast and Memory Optimal Low-Rank Matrix Approximation,Poster,"['Alexandre Proutiere', 'Se-Young Yun', 'marc lelarge']"
593,1992,Improving Performance in Neural Networks Using a Boosting Algorithm,,"['Patrice Simard', 'Robert Schapire', 'Harris Drucker']"
5930,2015,Stochastic Online Greedy Learning with Semi-bandit Feedbacks,Poster,"['Jian Li', 'Wei Chen', 'Tian Lin']"
5931,2015,Linear Multi-Resource Allocation with Semi-Bandit Feedback,Poster,"['Koby Crammer', 'Csaba Szepesvari', 'Tor Lattimore']"
5932,2015,Exactness of Approximate MAP Inference in Continuous MRFs,Poster,['Nicholas Ruozzi']
5933,2015,On the consistency theory of high dimensional variable screening,Poster,"['Chenlei Leng', 'David B. Dunson', 'Xiangyu Wang']"
5934,2015,Finite-Time Analysis of Projected Langevin Monte Carlo,Poster,"['Sebastien Bubeck', 'Ronen Eldan', 'Joseph Lehec']"
5935,2015,Beyond Sub-Gaussian Measurements: High-Dimensional Structured Estimation with Sub-Exponential Designs,Poster,"['Arindam Banerjee', 'Pradeep K. Ravikumar', 'Vidyashankar Sivakumar']"
5936,2015,Less is More: Nystr?m Computational Regularization,Oral,"['Lorenzo Rosasco', 'Alessandro Rudi', 'Raffaello Camoriano']"
5937,2015,Logarithmic Time Online Multiclass prediction,Spotlight,"['John Langford', 'Anna E. Choromanska']"
5938,2015,Collaborative Filtering with Graph Information: Consistency and Scalable Methods,Spotlight,"['Pradeep K. Ravikumar', 'Inderjit S. Dhillon', 'Nikhil Rao', 'Hsiang-Fu Yu']"
5939,2015,Efficient and Parsimonious Agnostic Active Learning,Spotlight,"['Robert E. Schapire', 'John Langford', 'Daniel J. Hsu', 'Alekh Agarwal', 'Tzu-Kuo Huang']"
594,1992,Statistical and Dynamical Interpretation of ISIH Data from Periodically Stimulated Sensory Neurons,,"['Andr? Longtin', 'John K. Douglass', 'Frank Moss']"
5940,2015,Matrix Completion with Noisy Side Information,Spotlight,"['Cho-Jui Hsieh', 'Inderjit S. Dhillon', 'Kai-Yang Chiang']"
5941,2015,Learning with Symmetric Label Noise: The Importance of Being Unhinged,Spotlight,"['Robert C. Williamson', 'Brendan van Rooyen', 'Aditya Menon']"
5942,2015,Scalable Semi-Supervised Aggregation of Classifiers,Spotlight,"['Yoav Freund', 'Akshay Balsubramani']"
5943,2015,Spherical Random Features for Polynomial Kernels,Spotlight,"['Sanjiv Kumar', 'Jeffrey Pennington', 'Felix X. Yu']"
5944,2015,Fast and Guaranteed Tensor Decomposition via Sketching,Spotlight,"['Anima Anandkumar', 'Alexander J. Smola', 'Hsiao-Yu Tung', 'Yining Wang']"
5945,2015,Teaching Machines to Read and Comprehend,Poster,"['Phil Blunsom', 'Karl Moritz Hermann', 'Tomas Kocisky', 'Edward Grefenstette', 'Lasse Espeholt', 'Will Kay', 'Mustafa Suleyman']"
5946,2015,"Saliency, Scale and Information: Towards a Unifying Theory",Poster,"['Neil Bruce', 'Shafin Rahman']"
5947,2015,Semi-supervised Learning with Ladder Networks,Poster,"['Harri Valpola', 'Tapani Raiko', 'Mathias Berglund', 'Mikko Honkala', 'Antti Rasmus']"
5948,2015,Enforcing balance allows local supervised learning in spiking recurrent networks,Poster,"['Sophie Den?ve', 'Ralph Bourdoukan']"
5949,2015,Semi-supervised Sequence Learning,Poster,"['Quoc V. Le', 'Andrew M. Dai']"
595,1992,Learning Spatio-Temporal Planning from a Dynamic Programming Teacher: Feed-Forward Neurocontrol for Moving Obstacle Avoidance,,"['Gerald Fahner', 'Rolf Eckmiller']"
5950,2015,Skip-Thought Vectors,Poster,"['Antonio Torralba', 'Ruslan R. Salakhutdinov', 'Sanja Fidler', 'Raquel Urtasun', 'Ryan Kiros', 'Richard Zemel', 'Yukun Zhu']"
5951,2015,Learning to Linearize Under Uncertainty,Poster,"['Yann LeCun', 'Ross Goroshin', 'Michael F. Mathieu']"
5952,2015,Synaptic Sampling: A Bayesian Approach to Neural Network Plasticity and Rewiring,Poster,"['Wolfgang Maass', 'Stefan Habenschuss', 'David Kappel', 'Robert Legenstein']"
5953,2015,Natural Neural Networks,Poster,"['Guillaume Desjardins', 'Karen Simonyan', 'koray kavukcuoglu', 'Razvan Pascanu']"
5954,2015,Convolutional Networks on Graphs for Learning Molecular Fingerprints,Poster,"['Ryan P. Adams', 'David K. Duvenaud', 'Dougal Maclaurin', 'Jorge Iparraguirre', 'Rafael Bombarell', 'Timothy Hirzel', 'Alan Aspuru-Guzik']"
5955,2015,Convolutional LSTM Network: A Machine Learning Approach for Precipitation Nowcasting,Poster,"['Dit-Yan Yeung', 'Hao Wang', 'Xingjian SHI', 'Zhourong Chen', 'Wai-kin Wong', 'Wang-chun WOO']"
5956,2015,Scheduled Sampling for Sequence Prediction with Recurrent Neural Networks,Poster,"['Samy Bengio', 'Oriol Vinyals', 'Navdeep Jaitly', 'Noam Shazeer']"
5957,2015,Mind the Gap: A Generative Approach to Interpretable Feature Selection and Extraction,Poster,"['Been Kim', 'Julie A. Shah', 'Finale Doshi-Velez']"
5958,2015,Max-Margin Deep Generative Models,Poster,"['Bo Zhang', 'Jun Zhu', 'Chongxuan Li', 'Tianlin Shi']"
5959,2015,Cross-Domain Matching for Bag-of-Words Data via Kernel Embeddings of Latent Distributions,Poster,"['Tomoharu Iwata', 'Takeshi Yamada', 'Yuya Yoshikawa', 'Hiroshi Sawada']"
596,1992,Learning to categorize objects using temporal coherence,,['Suzanna Becker']
5960,2015,A Gaussian Process Model of Quasar Spectral Energy Distributions,Poster,"['Dustin Lang', 'Ryan P. Adams', 'Andrew Miller', 'Albert Wu', 'Jeff Regier', 'Jon McAuliffe', 'Mr. Prabhat', 'David Schlegel']"
5961,2015,Neural Adaptive Sequential Monte Carlo,Poster,"['Zoubin Ghahramani', 'Richard E. Turner', 'Shixiang Gu']"
5962,2015,Convolutional spike-triggered covariance analysis for neural subunit models,Poster,"['Il Memming Park', 'Jonathan W. Pillow', 'Anqi Wu']"
5963,2015,Rectified Factor Networks,Poster,"['Sepp Hochreiter', 'Djork-Arn? Clevert', 'Andreas Mayr', 'Thomas Unterthiner']"
5964,2015,Embed to Control: A Locally Linear Latent Dynamics Model for Control from Raw Images,Poster,"['Martin Riedmiller', 'Manuel Watter', 'Jost Springenberg', 'Joschka Boedecker']"
5965,2015,Bayesian dark knowledge,Poster,"['Kevin P. Murphy', 'Max Welling', 'Anoop Korattikara Balan', 'Vivek Rathod']"
5966,2015,GP Kernels for Cross-Spectrum Analysis,Poster,"['Lawrence Carin', 'David E. Carlson', 'Kafui Dzirasa', 'Kyle R. Ulrich']"
5967,2015,End-to-end Learning of LDA by Mirror-Descent Back Propagation over a Deep Architecture,Poster,"['Li Deng', 'Lin Xiao', 'Jianshu Chen', 'Ji He', 'Yelong Shen', 'Xiaodong He', 'Jianfeng Gao', 'Xinying Song']"
5968,2015,Particle Gibbs for Infinite Hidden Markov Models,Poster,"['Zoubin Ghahramani', 'Nilesh Tripuraneni', 'Shixiang Gu', 'Hong Ge']"
5969,2015,Sparse Local Embeddings for Extreme Multi-label Classification,Poster,"['Prateek Jain', 'Purushottam Kar', 'Manik Varma', 'Kush Bhatia', 'Himanshu Jain']"
597,1992,Q-Learning with Hidden-Unit Restarting,,['Charles W. Anderson']
5970,2015,Robust Spectral Inference for Joint Stochastic Matrix Factorization,Poster,"['Moontae Lee', 'David Bindel', 'David Mimno']"
5971,2015,Space-Time Local Embeddings,Poster,"['Jun Wang', 'Alexandros Kalousis', 'Ke Sun', 'Stephane Marchand-Maillet']"
5972,2015,"A fast, universal algorithm to learn parametric nonlinear embeddings",Poster,"['Miguel A. Carreira-Perpinan', 'Max Vladymyrov']"
5973,2015,Bayesian Manifold Learning: The Locally Linear Latent Variable Model (LL-LVM),Poster,"['Maneesh Sahani', 'Lars Buesing', 'Mijung Park', 'Wittawat Jitkrittum', 'Ahmad Qamar', 'Zoltan Szabo']"
5974,2015,Local Causal Discovery of Direct Causes and Effects,Poster,"['Qiang Ji', 'Tian Gao']"
5975,2015,Discriminative Robust Transformation Learning,Poster,"['Guillermo Sapiro', 'Robert Calderbank', 'Jiaji Huang', 'Qiang Qiu']"
5976,2015,Max-Margin Majority Voting for Learning from Crowds,Poster,"['Jun Zhu', 'TIAN TIAN']"
5977,2015,M-Best-Diverse Labelings for Submodular Energies and Beyond,Poster,"['Carsten Rother', 'Bogdan Savchynskyy', 'Dmitry P. Vetrov', 'Alexander Kirillov', 'Dmytro Shlezinger']"
5978,2015,Covariance-Controlled Adaptive Langevin Thermostat for Large-Scale Bayesian Sampling,Poster,"['Amos J. Storkey', 'Xiaocheng Shang', 'Zhanxing Zhu', 'Benedict Leimkuhler']"
5979,2015,Time-Sensitive Recommendation From Recurrent User Activities,Poster,"['Le Song', 'Nan Du', 'Niao He', 'Yichen Wang', 'Jimeng Sun']"
598,1992,A Hybrid Neural Net System for State-of-the-Art Continuous Speech Recognition,,"['G. Zavaliagkos', 'Y. Zhao', 'R. Schwartz', 'J. Makhoul']"
5980,2015,Parallel Recursive Best-First AND/OR Search for Exact MAP Inference in Graphical Models,Poster,"['Akihiro Kishimoto', 'Radu Marinescu', 'Adi Botea']"
5981,2015,Bounding the Cost of Search-Based Lifted Inference,Poster,"['Vibhav G. Gogate', 'David B. Smith']"
5982,2015,Efficient Learning by Directed Acyclic Graph For Resource Constrained Prediction,Poster,"['Venkatesh Saligrama', 'Joseph Wang', 'Kirill Trapeznikov']"
5983,2015,Estimating Jaccard Index with Missing Observations: A Matrix Calibration Approach,Poster,['Wenye Li']
5984,2015,Sample Efficient Path Integral Control under Uncertainty,Poster,"['Yunpeng Pan', 'Evangelos Theodorou', 'Michail Kontitsis']"
5985,2015,Efficient Thompson Sampling for Online ?Matrix-Factorization Recommendation,Poster,"['Branislav Kveton', 'Sanjay Chawla', 'Jaya Kawale', 'Hung H. Bui', 'Long Tran-Thanh']"
5986,2015,Parallelizing MCMC with Random Partition Trees,Poster,"['Katherine A. Heller', 'David B. Dunson', 'Xiangyu Wang', 'Fangjian Guo']"
5987,2015,Fast Lifted MAP Inference via Partitioning,Poster,"['Vibhav G. Gogate', 'Parag Singla', 'Somdeb Sarkhel']"
5988,2015,Active Learning from Weak and Strong Labelers,Poster,"['Kamalika Chaudhuri', 'Chicheng Zhang']"
5989,2015,Learnability of Influence in Networks,Poster,"['David C. Parkes', 'Harikrishna Narasimhan', 'Yaron Singer']"
599,1992,Harmonic Grammars for Formal Languages,,['Paul Smolensky']
5990,2015,A Pseudo-Euclidean Iteration for Optimal Recovery in Noisy ICA,Poster,"['Mikhail Belkin', 'James R. Voss', 'Luis Rademacher']"
5991,2015,Differentially private subspace clustering,Poster,"['Aarti Singh', 'Yu-Xiang Wang', 'Yining Wang']"
5992,2015,Compressive spectral embedding: sidestepping the SVD,Poster,"['Dinesh Ramasamy', 'Upamanyu Madhow']"
5993,2015,Generalization in Adaptive Data Analysis and Holdout Reuse,Poster,"['Moritz Hardt', 'Vitaly Feldman', 'Toni Pitassi', 'Cynthia Dwork', 'Omer Reingold', 'Aaron Roth']"
5994,2015,Online F-Measure Optimization,Poster,"['Eyke H?llermeier', 'Bal?zs Sz?r?nyi', 'R?bert Busa-Fekete', 'Krzysztof Dembczynski']"
5995,2015,A Market Framework for Eliciting Private Data,Poster,"['Jacob D. Abernethy', 'Rafael Frongillo', 'Bo Waggoner']"
5996,2015,Optimal Ridge Detection using Coverage Risk,Poster,"['Christopher R. Genovese', 'Larry Wasserman', 'Yen-Chi Chen', 'Shirley Ho']"
5997,2015,Fast Distributed k-Center Clustering with Outliers on Massive Data,Poster,"['Kilian Q. Weinberger', 'Gustavo Malkomes', 'Matt J. Kusner', 'Wenlin Chen', 'Benjamin Moseley']"
5998,2015,Orthogonal NMF through Subspace Exploration,Poster,"['Alexandros G. Dimakis', 'Dimitris Papailiopoulos', 'Megasthenis Asteris']"
5999,2015,Fast Classification Rates for High-dimensional Gaussian Generative Models,Poster,"['Pradeep K. Ravikumar', 'Adarsh Prasad', 'Tianyang Li']"
6,1987,A Neural-Network Solution to the Concentrator Assignment Problem,,"['Gene A. Tagliarini', 'Edward W. Page']"
60,1987,The Hopfield Model with Multi-Level Neurons,,['Michael Fleisher']
600,1992,A Neural Network that Learns to Interpret Myocardial Planar Thallium Scintigrams,,"['Charles Rosenberg', 'Jacob Erel', 'Henri Atlan']"
6000,2015,Predtron: A Family of Online Algorithms for General Prediction Problems,Poster,"['Ambuj Tewari', 'Prateek Jain', 'Nagarajan Natarajan']"
6001,2015,On the Optimality of Classifier Chain for Multi-label Classification,Poster,"['Weiwei Liu', 'Ivor Tsang']"
6002,2015,Smooth Interactive Submodular Set Cover,Poster,"['Yisong Yue', 'Bryan D. He']"
6003,2015,Tractable Bayesian Network Structure Learning with Bounded Vertex Cover Number,Poster,"['Janne H. Korhonen', 'Pekka Parviainen']"
6004,2015,Secure Multi-party Differential Privacy,Poster,"['Sewoong Oh', 'Peter Kairouz', 'Pramod Viswanath']"
6005,2015,Adaptive Stochastic Optimization: From Sets to Paths,Poster,"['Wee Sun Lee', 'David Hsu', 'Zhan Wei Lim']"
6006,2015,Learning structured densities via infinite dimensional exponential families,Poster,"['Jinbo Xu', 'Siqi Sun', 'mladen kolar']"
6007,2015,Lifelong Learning with Non-i.i.d. Tasks,Poster,"['Christoph H. Lampert', 'Anastasia Pentina']"
6008,2015,Algorithms with Logarithmic or Sublinear Regret for  Constrained Contextual Bandits,Poster,"['Huasen Wu', 'R. Srikant', 'Xin Liu', 'Chong Jiang']"
6009,2015,From random walks to distances on unweighted graphs,Poster,"['Tommi Jaakkola', 'Yi Sun', 'Tatsunori Hashimoto']"
601,1992,"Learning Curves, Model Selection and Complexity of Neural Networks",,"['Shuji Yoshizawa', 'Noboru Murata', 'Shun-ichi Amari']"
6010,2015,Robust Regression via Hard Thresholding,Poster,"['Prateek Jain', 'Purushottam Kar', 'Kush Bhatia']"
6011,2015,Column Selection via Adaptive Sampling,Poster,"['Malik Magdon-Ismail', 'Petros Drineas', 'Saurabh Paul']"
6012,2015,Multi-class SVMs: From Tighter Data-Dependent Generalization Bounds to Novel Algorithms,Poster,"['Marius Kloft', 'Yunwen Lei', 'Urun Dogan', 'Alexander Binder']"
6013,2015,Optimal Linear Estimation under Unknown Nonlinear Transform,Poster,"['Han Liu', 'Constantine Caramanis', 'Zhaoran Wang', 'Xinyang Yi']"
6014,2015,Risk-Sensitive and Robust Decision-Making: a CVaR Optimization Approach,Poster,"['Shie Mannor', 'Yinlam Chow', 'Aviv Tamar', 'Marco Pavone']"
6015,2015,Learning with Incremental Iterative Regularization,Poster,"['Lorenzo Rosasco', 'Silvia Villa']"
6016,2015,No-Regret Learning in Bayesian Games,Poster,"['Vasilis Syrgkanis', 'Jason Hartline', 'Eva Tardos']"
6017,2015,Sparse and Low-Rank Tensor Decomposition,Poster,"['Nikhil Rao', 'Parikshit Shah', 'Gongguo Tang']"
6018,2015,Analysis of Robust PCA via Local Incoherence,Poster,"['Huishuai Zhang', 'Yi Zhou', 'Yingbin Liang']"
6019,2015,Algorithmic Stability and Uniform Generalization,Poster,['Ibrahim M. Alabdulmohsin']
602,1992,Unsmearing Visual Motion: Development of Long-Range Horizontal Intrinsic Connections,,"['Kevin E. Martin', 'Jonathan A. Marshall']"
