id,year,title,event_type,authors
1,1987,Self-Organization of Associative Database and Its Applications,,"['Hisashi Suzuki', 'Suguru Arimoto']"
10,1987,A Mean Field Theory of Layer IV of Visual Cortex and Its Application to Artificial Neural Networks,,['Christopher L. Scofield']
100,1988,Storing Covariance by the Associative Long-Term Potentiation and Depression of Synaptic Strengths in the Hippocampus,,"['Terrence J. Sejnowski', 'Patric K. Stanton']"
1000,1994,Bayesian Query Construction for Neural Network Models,,"['Gerhard Paass', 'J?rg Kindermann']"
1001,1994,"Neural Network Ensembles, Cross Validation, and Active Learning",,"['Anders Krogh', 'Jesper Vedelsby']"
1002,1994,Using a neural net to instantiate a deformable model,,"['Geoffrey E. Hinton', 'Christopher K. I. Williams', 'Michael Revow']"
1003,1994,Plasticity-Mediated Competitive Learning,,"['Terrence J. Sejnowski', 'Nicol N. Schraudolph']"
1004,1994,ICEG Morphology Classification using an Analogue VLSI Neural Network,,"['Barry Flower', 'Marwan A. Jabri', 'Richard Coggins', 'Stephen Pickard']"
1005,1994,Real-Time Control of a Tokamak Plasma Using Neural Networks,,"['Chris M. Bishop', 'Paul S. Haynes', 'Mike E U Smith', 'Tom N. Todd', 'David L. Trotman', 'Colin G. Windsor']"
1006,1994,Pulsestream Synapses with Non-Volatile Analogue Amorphous-Silicon Memories,,"['Alan F. Murray', 'Stephen Churcher', 'A. J. Holmes', 'J. Hajto', 'M. J. Rose']"
1007,1994,Learning to Play the Game of Chess,,['Sebastian Thrun']
1008,1994,Multidimensional Scaling and Data Clustering,,"['Joachim Buhmann', 'Thomas Hofmann']"
1009,1994,An experimental comparison of recurrent neural networks,,"['C. Lee Giles', 'Bill G. Horne']"
101,1988,Training Multilayer Perceptrons with the Extended Kalman Algorithm,,"['Sharad Singhal', 'Lance Wu']"
1010,1994,Interference in Learning Internal Models of Inverse Dynamics in Humans,,"['Reza Shadmehr', 'Ferdinando A. Mussa-Ivaldi', 'Tom Brashers-Krug']"
1011,1994,Active Learning with Statistical Models,,"['Michael I. Jordan', 'David A. Cohn', 'Zoubin Ghahramani']"
1012,1994,A Rapid Graph-based Method for Arbitrary Transformation-Invariant Pattern Classification,,"['David G. Stork', 'Alessandro Sperduti']"
1013,1994,Ocular Dominance and Patterned Lateral Connections in a Self-Organizing Model of the Primary Visual Cortex,,"['Joseph Sirosh', 'Risto Miikkulainen']"
1014,1994,Associative Decorrelation Dynamics: A Theory of Self-Organization and Optimization in Feedback Networks,,['Dawei W. Dong']
1015,1994,A Connectionist Technique for Accelerated Textual Input: Letting a Network Do the Typing,,['Dean Pomerleau']
1016,1994,Connectionist Speaker Normalization with Generalized Resource Allocating Networks,,"['Cesare Furlanello', 'Diego Giuliani', 'Edmondo Trentin']"
1017,1994,A Critical Comparison of Models for Orientation and Ocular Dominance Columns in the Striate Cortex,,"['K. Obermayer', 'K. Schulten', 'E. Erwin']"
1018,1994,Generalization in Reinforcement Learning: Safely Approximating the Value Function,,"['Andrew W. Moore', 'Justin A. Boyan']"
1019,1994,A Mixture Model System for Medical and Machine Diagnosis,,"['Terrence J. Sejnowski', 'Magnus Stensmo']"
102,1988,An Application of the Principle of Maximum Information Preservation to Linear Systems,,['Ralph Linsker']
1020,1994,A Computational Model of Prefrontal Cortex Function,,"['David Servan-Schreiber', 'Jonathan D. Cohen', 'Todd S. Braver']"
1021,1995,The Gamma MLP for Speech Phoneme Recognition,,"['Ah Chung Tsoi', 'Andrew D. Back', 'Steve Lawrence']"
1022,1995,A Multiscale Attentional Framework for Relaxation Neural Networks,,"['Eric Mjolsness', 'Dimitris I. Tsioutsias']"
1023,1995,Correlated Neuronal Response: Time Scales and Mechanisms,,"['Christof Koch', 'Wyeth Bair', 'Ehud Zohary']"
1024,1995,Onset-based Sound Segmentation,,['Leslie S. Smith']
1025,1995,A model of transparent motion and non-transparent motion aftereffects,,"['Susan L. McCabe', 'Michael J. Denham']"
1026,1995,A Model of Auditory Streaming,,"['Susan L. McCabe', 'Michael J. Denham']"
1027,1995,REMAP: Recursive Estimation and Maximization of A Posteriori Probabilities - Application to Transition-Based Connectionist Speech Recognition,,"['Herv? Bourlard', 'Nelson Morgan', 'Yochai Konig']"
1028,1995,Exponentially many local minima for single neurons,,"['Manfred K. Warmuth', 'Peter Auer', 'Mark Herbster']"
1029,1995,A Practical Monte Carlo Implementation of Bayesian Learning,,['Carl Edward Rasmussen']
103,1988,An Adaptive Network That Learns Sequences of Transitions,,['C. L. Winter']
1030,1995,Neuron-MOS Temporal Winner Search Hardware for Fully-Parallel Data Processing,,"['Tadashi Shibata', 'Takeo Yamashita', 'Tadahiro Ohmi', 'Tsutomu Nakai', 'Tatsuo Morimoto', 'Ryu Kaihara']"
1031,1995,Dynamics of Attention as Near Saddle-Node Bifurcation Behavior,,"['Kenji Doya', 'Hiroyuki Nakahara']"
1032,1995,VLSI Model of Primate Visual Smooth Pursuit,,"['Paul Mueller', 'Jan Van der Spiegel', 'Ralph Etienne-Cummings']"
1033,1995,Gradient and Hamiltonian Dynamics Applied to Learning in Neural Networks,,"['James W. Howse', 'Chaouki T. Abdallah', 'Gregory L. Heileman']"
1034,1995,Is Learning The n-th Thing Any Easier Than Learning The First?,,['Sebastian Thrun']
1035,1995,A Dynamical Model of Context Dependencies for the Vestibulo-Ocular Reflex,,"['Terrence J. Sejnowski', 'Olivier J. M. D. Coenen']"
1036,1995,Improved Gaussian Mixture Density Estimates Using Bayesian Penalty Terms and Network Averaging,,"['Volker Tresp', 'Dirk Ormoneit']"
1037,1995,Quadratic-Type Lyapunov Functions for Competitive Neural Networks with Different Time-Scales,,['Anke Meyer-B?se']
1038,1995,Stable LInear Approximations to Dynamic Programming for Stochastic Control Problems with Local Transitions,,"['Benjamin Van Roy', 'John N. Tsitsiklis']"
1039,1995,Context-Dependent Classes in a Hybrid Recurrent Network-HMM Speech Recognition System,,"['Mike Hochberg', 'Anthony J. Robinson', 'Dan J. Kershaw']"
104,1988,Digital Realisation of Self-Organising Maps,,"['Nigel M. Allinson', 'Martin J. Johnson', 'Kevin J. Moon']"
1040,1995,Empirical Entropy Manipulation for Real-World Problems,,"['Terrence J. Sejnowski', 'Paul A. Viola', 'Nicol N. Schraudolph']"
1041,1995,The Geometry of Eye Rotations and Listing's Law,,"['Tamar Flash', 'Amir A. Handzel']"
1042,1995,Reinforcement Learning by Probability Matching,,"['Michael I. Jordan', 'Philip N. Sabes']"
1043,1995,Neural Control for Nonlinear Dynamic Systems,,"['Ssu-Hsin Yu', 'Anuradha M. Annaswamy']"
1044,1995,Learning with ensembles: How overfitting can be useful,,"['Anders Krogh', 'Peter Sollich']"
1045,1995,SEEMORE: A View-Based Approach to 3-D Object Recognition Using Multiple Visual Cues,,['Bartlett W. Mel']
1046,1995,Analog VLSI Processor Implementing the Continuous Wavelet Transform,,"['Gert Cauwenberghs', 'R. Timothy Edwards']"
1047,1995,Selective Attention for Handwritten Digit Recognition,,['Ethem Alpaydin']
1048,1995,Gaussian Processes for Regression,,"['Christopher K. I. Williams', 'Carl Edward Rasmussen']"
1049,1995,Modern Analytic Techniques to Solve the Dynamics of Recurrent Neural Networks,,"['A.C.C. Coolen', 'D. Sherrington', 'S. N. Laughton']"
105,1988,Backpropagation and Its Application to Handwritten Signature Verification,,"['Joseph W. Goodman', 'Timothy S. Wilkinson', 'Dorothy A. Mighell']"
1050,1995,Family Discovery,,['Stephen M. Omohundro']
1051,1995,Neural Networks with Quadratic VC Dimension,,"['Eduardo D. Sontag', 'Pascal Koiran']"
1052,1995,Learning the Structure of Similarity,,['Joshua B. Tenenbaum']
1053,1995,Reorganisation of Somatosensory Cortex after Tactile Training,,"['Rasmus S. Petersen', 'John G. Taylor']"
1054,1995,Implementation Issues in the Fourier Transform Algorithm,,"['Yishay Mansour', 'Sigal Sahar']"
1055,1995,Adaptive Retina with Center-Surround Receptive Field,,"['Shih-Chii Liu', 'Kwabena Boahen']"
1056,1995,Forward-backward retraining of recurrent neural networks,,"['Anthony J. Robinson', 'Andrew W. Senior']"
1057,1995,When is an Integrate-and-fire Neuron like a Poisson Neuron?,,"['Anthony M. Zador', 'Charles F. Stevens']"
1058,1995,From Isolation to Cooperation: An Alternative View of a System of Experts,,"['Christopher G. Atkeson', 'Stefan Schaal']"
1059,1995,Boosting Decision Trees,,"['Harris Drucker', 'Corinna Cortes']"
106,1988,Constraints on Adaptive Networks for Modeling Human Generalization,,"['Mark A. Gluck', 'M. Pavel', 'Van Henkle']"
1060,1995,Statistical Theory of Overtraining - Is Cross-Validation Asymptotically Effective?,,"['Noboru Murata', 'Shun-ichi Amari', 'Michael Finke', 'Klaus-Robert M?ller', 'Howard Hua Yang']"
1061,1995,Stable Dynamic Parameter Adaption,,['Stefan M. R?ger']
1062,1995,Universal Approximation and Learning of Trajectories Using Oscillators,,"['Pierre Baldi', 'Kurt Hornik']"
1063,1995,Learning Fine Motion by Markov Mixtures of Experts,,"['Michael I. Jordan', 'Marina Meila']"
1064,1995,Estimating the Bayes Risk from Sample Data,,"['Robert R. Snapp', 'Tong Xu']"
1065,1995,A Unified Learning Scheme: Bayesian-Kullback Ying-Yang Machine,,['Lei Xu']
1066,1995,On Neural Networks with Minimal Weights,,"['Jehoshua Bruck', 'Vasken Bohossian']"
1067,1995,SPERT-II: A Vector Microprocessor System and its Application to Large Problems in Backpropagation Training,,"['Nelson Morgan', 'James Beck', 'John Wawrzynek', 'Krste Asanovic', 'Brian Kingsbury', 'David Johnson']"
1068,1995,A Neural Network Model of 3-D Lightness Perception,,"['Luiz Pessoa', 'William D. Ross']"
1069,1995,How Perception Guides Production in Birdsong Learning,,['Christopher L. Fry']
107,1988,Neural Network Recognizer for Hand-Written Zip Code Digits,,"['John S. Denker', 'Isabelle Guyon', 'Hans Peter Graf', 'W. R. Gardner', 'Donnie Henderson', 'R. E. Howard', 'W. Hubbard', 'L. D. Jackel', 'Henry S. Baird']"
1070,1995,"A Bound on the Error of Cross Validation Using the Approximation and Estimation Rates, with Consequences for the Training-Test Split",,['Michael J. Kearns']
1071,1995,A Model of Spatial Representations in Parietal Cortex Explains Hemineglect,,"['Terrence J. Sejnowski', 'Alexandre Pouget']"
1072,1995,Dynamics of On-Line Gradient Descent Learning for Multilayer Neural Networks,,"['Sara A. Solla', 'David Saad']"
1073,1995,Improving Elevator Performance Using Reinforcement Learning,,"['Andrew G. Barto', 'Robert H. Crites']"
1074,1995,Visual gesture-based robot guidance with a modular neural system,,"['Helge Ritter', 'Enno Littmann', 'Andrea Drees']"
1075,1995,Improving Committee Diagnosis with Resampling Techniques,,"['Paul W. Munro', 'Bambang Parmanto', 'Howard R. Doyle']"
1076,1995,Learning Sparse Perceptrons,,"['Mark Craven', 'Jeffrey C. Jackson']"
1077,1995,A Neural Network Autoassociator for Induction Motor Failure Prediction,,"['Stephen Jose Hanson', 'Thomas Petsche', 'Christian Darken', 'Gary M. Kuhn', 'Angelo Marcantonio', 'N. Iwan Santoso']"
1078,1995,Modeling Interactions of the Rat's Place and Head Direction Systems,,"['David S. Touretzky', 'A. David Redish']"
1079,1995,Active Gesture Recognition using Learned Visual Attention,,"['Trevor Darrell', 'Alex Pentland']"
108,1988,Neural Networks for Model Matching and Perceptual Organization,,"['Eric Mjolsness', 'Gene Gindi', 'P. Anandan']"
1080,1995,Symplectic Nonlinear Component Analysis,,['Lucas C. Parra']
1081,1995,"Using the Future to ""Sort Out"" the Present: Rankprop and Multitask Learning for Medical Risk Evaluation",,"['Shumeet Baluja', 'Rich Caruana', 'Tom Mitchell']"
1082,1995,Prediction of Beta Sheets in Proteins,,"['Anders Krogh', 'Soren Kamaric Riis']"
1083,1995,Unsupervised Pixel-prediction,,['William R. Softky']
1084,1995,High-Speed Airborne Particle Monitoring Using Artificial Neural Networks,,"['Alistair Ferguson', 'Theo Sabisch', 'Paul Kaye', 'Laurence C. Dixon', 'Hamid Bolouri']"
1085,1995,High-Performance Job-Shop Scheduling With A Time-Delay TD(?) Network,,"['Thomas G. Dietterich', 'Wei Zhang']"
1086,1995,Examples of learning curves from a modified VC-formalism,,"['Robert C. Williamson', 'Peter L. Bartlett', 'Adam Kowalczyk', 'Jacek Szymanski']"
1087,1995,Using Feedforward Neural Networks to Monitor Alertness from Changes in EEG Correlation and Coherence,,"['Terrence J. Sejnowski', 'Scott Makeig', 'Tzyy-Ping Jung']"
1088,1995,Softassign versus Softmax: Benchmarks in Combinatorial Optimization,,"['Steven Gold', 'Anand Rangarajan']"
1089,1995,Beating a Defender in Robotic Soccer: Memory-Based Learning of a Continuous Function,,"['Peter Stone', 'Manuela M. Veloso']"
109,1988,Applications of Error Back-Propagation to Phonetic Classification,,"['Hong C. Leung', 'Victor W. Zue']"
1090,1995,Absence of Cycles in Symmetric Neural Networks,,"['Fernanda Botelho', 'Xin Wang', 'Max H. Garzon', 'Arun K. Jagota']"
1091,1995,Independent Component Analysis of Electroencephalographic Data,,"['Terrence J. Sejnowski', 'Anthony J. Bell', 'Scott Makeig', 'Tzyy-Ping Jung']"
1092,1995,Clustering data through an analogy to the Potts model,,"['Eytan Domany', 'Marcelo Blatt', 'Shai Wiseman']"
1094,1995,Plasticity of Center-Surround Opponent Receptive Fields in Real and Artificial Neural Systems of Vision,,"['S. Yasui', 'T. Furukawa', 'M. Yamada', 'T. Saito']"
1095,1995,Worst-case Loss Bounds for Single Neurons,,"['David P. Helmbold', 'Jyrki Kivinen', 'Manfred K. Warmuth']"
1096,1995,Predictive Q-Routing: A Memory-based Reinforcement Learning Approach to Adaptive Traffic Control,,"['Samuel P. M. Choi', 'Dit-Yan Yeung']"
1097,1995,Using Unlabeled Data for Supervised Learning,,['Geoffrey G. Towell']
1098,1995,Discovering Structure in Continuous Variables Using Bayesian Networks,,"['Volker Tresp', 'Reimar Hofmann']"
1099,1995,Adaptive Mixture of Probabilistic Transducers,,['Yoram Singer']
11,1987,Microelectronic Implementations of Connectionist Neural Networks,,"['John S. Denker', 'Stuart Mackie', 'Hans Peter Graf', 'Daniel B. Schwartz']"
110,1988,Adaptive Neural Networks Using MOS Charge Storage,,"['Daniel B. Schwartz', 'R. E. Howard', 'Wayne E. Hubbard']"
1100,1995,Tempering Backpropagation Networks: Not All Weights are Created Equal,,"['Terrence J. Sejnowski', 'Nicol N. Schraudolph']"
1101,1995,Finite State Automata that Recurrent Cascade-Correlation Cannot Represent,,['Stefan C. Kremer']
1102,1995,Hierarchical Recurrent Neural Networks for Long-Term Dependencies,,"['Yoshua Bengio', 'Salah El Hihi']"
1103,1995,Optimizing Cortical Mappings,,"['Terrence J. Sejnowski', 'Geoffrey J. Goodhill', 'Steven Finch']"
1104,1995,KODAK lMAGELINK? OCR Alphanumeric Handprint Module,,"['Alexander Shustorovich', 'Christopher W. Thrasher']"
1105,1995,Cholinergic suppression of transmission may allow combined associative memory function and self-organization in the neocortex,,"['Michael E. Hasselmo', 'Milos Cekic']"
1106,1995,Handwritten Word Recognition using Contextual Hybrid Radial Basis Function Network/Hidden Markov Models,,"['Bernard Lemari?', 'Michel Gilloux', 'Manuel Leroux']"
1107,1995,Human Reading and the Curse of Dimensionality,,['Gale Martin']
1108,1995,Sample Complexity for Learning Recurrent Perceptron Mappings,,"['Eduardo D. Sontag', 'Bhaskar DasGupta']"
1109,1995,Generalization in Reinforcement Learning: Successful Examples Using Sparse Coarse Coding,,['Richard S. Sutton']
111,1988,Dynamics of Analog Neural Networks with Time Delay,,"['Charles M. Marcus', 'R. M. Westervelt']"
1111,1995,Fast Learning by Bounding Likelihoods in Sigmoid Type Belief Networks,,"['Michael I. Jordan', 'Tommi Jaakkola', 'Lawrence K. Saul']"
1112,1995,Learning Model Bias,,['Jonathan Baxter']
1113,1995,Generalized Learning Vector Quantization,,"['Atsushi Sato', 'Keiji Yamada']"
1114,1995,Stock Selection via Nonlinear Multi-Factor Models,,['Asriel E. Levin']
1115,1995,A New Learning Algorithm for Blind Signal Separation,,"['Shun-ichi Amari', 'Howard Hua Yang', 'Andrzej Cichocki']"
1116,1995,Classifying Facial Action,,"['Terrence J. Sejnowski', 'Paul A. Viola', 'Jan Larsen', 'Marian Stewart Bartlett', 'Beatrice A. Golomb', 'Joseph C. Hager', 'Paul Ekman']"
1117,1995,Parallel Optimization of Motion Controllers via Policy Iteration,,"['Jefferson A. Coelho Jr.', 'R. Sitaraman', 'Roderic A. Grupen']"
1118,1995,A Framework for Non-rigid Matching and Correspondence,,"['Steven Gold', 'Anand Rangarajan', 'Suguna Pappu']"
1119,1995,A Smoothing Regularizer for Recurrent Neural Networks,,"['John E. Moody', 'Lizhong Wu']"
112,1988,Cricket Wind Detection,,['John P. Miller']
1120,1995,Optimization Principles for the Neural Code,,['Michael DeWeese']
1121,1995,Optimal Asset Allocation using Adaptive Dynamic Programming,,['Ralph Neuneier']
1122,1995,Recursive Estimation of Dynamic Modular RBF Networks,,"['Visakan Kadirkamanathan', 'Maha Kadirkamanathan']"
1123,1995,Silicon Models for Auditory Scene Analysis,,"['John Lazzaro', 'John Wawrzynek']"
1124,1995,Memory-based Stochastic Optimization,,"['Andrew W. Moore', 'Jeff G. Schneider']"
1125,1995,Parallel analog VLSI architectures for computation of heading direction and time-to-contact,,"['Christof Koch', 'Giacomo Indiveri', 'J?rg Kramer']"
1126,1995,Recurrent Neural Networks for Missing or Asynchronous Data,,"['Yoshua Bengio', 'Francois Gingras']"
1127,1995,A Realizable Learning Task which Exhibits Overfitting,,['Siegfried B?s']
1128,1995,Modeling Saccadic Targeting in Visual Search,,"['Dana H. Ballard', 'Rajesh P. N. Rao', 'Gregory J. Zelinsky', 'Mary M. Hayhoe']"
1129,1995,Simulation of a Thalamocortical Circuit for Computing Directional Heading in the Rat,,['Hugh T. Blair']
113,1988,Use of Multi-Layered Networks for Coding Speech with Phonetic Features,,"['Yoshua Bengio', 'R?gis Cardin', 'Renato de Mori', 'Piero Cosi']"
1130,1995,Some results on convergent unlearning algorithm,,"['Serguei A. Semenov', 'Irina B. Shuvalova']"
1131,1995,Discriminant Adaptive Nearest Neighbor Classification and Regression,,"['Trevor Hastie', 'Robert Tibshirani']"
1132,1995,EM Optimization of Latent-Variable Density Models,,"['Christopher K. I. Williams', 'Christopher M. Bishop', 'Markus Svens?n']"
1133,1995,Stable Fitted Reinforcement Learning,,['Geoffrey J. Gordon']
1134,1995,Competence Acquisition in an Autonomous Mobile Robot using Hardware Neural Techniques,,"['Alan F. Murray', 'Geoffrey B. Jackson']"
1135,1995,Information through a Spiking Neuron,,"['Anthony M. Zador', 'Charles F. Stevens']"
1136,1995,The Capacity of a Bump,,['Gary William Flake']
1138,1995,A Dynamical Systems Approach for a Learnable Autonomous Robot,,"['Naohiro Fukumura', 'Jun Tani']"
1139,1995,Rapid Quality Estimation of Neural Network Input Representations,,"['Jude W. Shavlik', 'Kevin J. Cherkauer']"
114,1988,Implications of Recursive Distributed Representations,,['Jordan B. Pollack']
1140,1995,Active Learning in Multilayer Perceptrons,,['Kenji Fukumizu']
1141,1995,Investment Learning with Hierarchical PSOMs,,"['Helge Ritter', 'J?rg A. Walter']"
1142,1995,Explorations with the Dynamic Wave Model,,"['Jeffrey L. Elman', 'Thomas P. Rebotier']"
1143,1995,Improving Policies without Measuring Merits,,"['Peter Dayan', 'Satinder P. Singh']"
1144,1995,Factorial Hidden Markov Models,,"['Michael I. Jordan', 'Zoubin Ghahramani']"
1145,1995,A Predictive Switching Model of Cerebellar Movement Control,,"['James C. Houk', 'Andrew G. Barto']"
1146,1995,The Role of Activity in Synaptic Competition at the Neuromuscular Junction,,"['Samuel R. H. Joseph', 'David J. Willshaw']"
1147,1995,Geometry of Early Stopping in Linear Networks,,['Robert H. Dodier']
1148,1995,Strong Unimodality and Exact Learning of Constant Depth ?-Perceptron Networks,,"['Mario Marchand', 'Saeed Hadjifaradji']"
1149,1995,Laterally Interconnected Self-Organizing Maps in Hand-Written Digit Recognition,,"['Joseph Sirosh', 'Risto Miikkulainen', 'Yoonsuck Choe']"
115,1988,Heterogeneous Neural Networks for Adaptive Behavior in Dynamic Environments,,"['Randall D. Beer', 'Hillel J. Chiel', 'Leon S. Sterling']"
1150,1995,Primitive Manipulation Learning with Connectionism,,['Yoky Matsuoka']
1151,1995,Learning long-term dependencies is not as difficult with NARX networks,,"['C. Lee Giles', 'Bill G. Horne', 'Tsungnan Lin', 'Peter Ti?o']"
1152,1995,Extracting Tree-Structured Representations of Trained Networks,,"['Jude W. Shavlik', 'Mark Craven']"
1153,1995,Does the Wake-sleep Algorithm Produce Good Density Estimators?,,"['Geoffrey E. Hinton', 'Peter Dayan', 'Brendan J. Frey']"
1154,1995,"Control of Selective Visual Attention: Modeling the ""Where"" Pathway",,"['Christof Koch', 'Ernst Niebur']"
1155,1995,Exploiting Tractable Substructures in Intractable Networks,,"['Michael I. Jordan', 'Lawrence K. Saul']"
1156,1995,Adaptive Back-Propagation in On-Line Learning of Multilayer Networks,,"['David Saad', 'Ansgar H. L. West']"
1157,1995,Temporal coding in the sub-millisecond range: Model of barn owl auditory pathway,,"['Wulfram Gerstner', 'J. Leo van Hemmen', 'Richard Kempter', 'Hermann Wagner']"
1158,1995,On the Computational Power of Noisy Spiking Neurons,,['Wolfgang Maass']
1159,1995,A Novel Channel Selection System in Cochlear Implants Using Artificial Neural Network,,"['Marwan A. Jabri', 'Raymond J. Wang']"
116,1988,Convergence and Pattern-Stabilization in the Boltzmann Machine,,"['Moshe Kam', 'Roger Cheng']"
1160,1995,Harmony Networks Do Not Work,,['Ren? Gourley']
1161,1995,An Information-theoretic Learning Algorithm for Neural Network Classification,,"['Allen Gersho', 'David J. Miller', 'Ajit V. Rao', 'Kenneth Rose']"
1162,1995,Experiments with Neural Networks for Real Time Implementation of Control,,"['Adam Kowalczyk', 'Herman L. Ferr?', 'Peter K. Campbell', 'Michael Dale']"
1163,1995,Generalisation of A Class of Continuous Neural Networks,,"['John Shawe-Taylor', 'Jieyu Zhao']"
1164,1995,Learning to Predict Visibility and Invisibility from Occlusion Events,,"['Jonathan A. Marshall', 'Richard K. Alley', 'Robert S. Hubbard']"
1165,1995,Constructive Algorithms for Hierarchical Mixtures of Experts,,"['Steve R. Waterhouse', 'Anthony J. Robinson']"
1166,1995,Model Matching and SFMD Computation,,"['Steven Rehfuss', 'Dan W. Hammerstrom']"
1167,1995,Bayesian Methods for Mixtures of Experts,,"['Steve R. Waterhouse', 'Anthony J. Robinson', 'David MacKay']"
1168,1995,Human Face Detection in Visual Scenes,,"['Shumeet Baluja', 'Henry A. Rowley', 'Takeo Kanade']"
1169,1995,Temporal Difference Learning in Continuous Time and Space,,['Kenji Doya']
1170,1995,A Neural Network Classifier for the I100 OCR Chip,,"['John C. Platt', 'Timothy P. Allen']"
1171,1995,Using Pairs of Data-Points to Define Splits for Decision Trees,,"['Geoffrey E. Hinton', 'Michael Revow']"
1172,1995,Stochastic Hillclimbing as a Baseline Method for Evaluating Genetic Algorithms,,"['Ari Juels', 'Martin Wattenberg']"
1173,1995,Improved Silicon Cochlea using Compatible Lateral Bipolar Transistors,,"['Andr? van Schaik', 'Eric Fragni?re', 'Eric A. Vittoz']"
1174,1995,"Pruning with generalization based weight saliencies: ?OBD, ?OBS",,"['Morten With Pedersen', 'Lars Kai Hansen', 'Jan Larsen']"
1175,1995,Generating Accurate and Diverse Members of a Neural-Network Ensemble,,"['Jude W. Shavlik', 'David W. Opitz']"
1176,1996,Statistical Mechanics of the Mixture of Experts,,"['Kukjin Kang', 'Jong-Hoon Oh']"
1177,1996,Microscopic Equations in Rough Energy Landscape for Neural Networks,,['K. Y. Michael Wong']
1178,1996,An Architectural Mechanism for Direction-tuned Cortical Simple Cells: The Role of Mutual Inhibition,,"['Silvio P. Sabatini', 'Fabio Solari', 'Giacomo M. Bisio']"
1179,1996,Maximum Likelihood Blind Source Separation: A Context-Sensitive Generalization of ICA,,"['Barak A. Pearlmutter', 'Lucas C. Parra']"
118,1988,Learning by Choice of Internal Representations,,"['Tal Grossman', 'Ronny Meir', 'Eytan Domany']"
1180,1996,Representing Face Images for Emotion Classification,,"['Garrison W. Cottrell', 'Curtis Padgett']"
1181,1996,Early Brain Damage,,"['Volker Tresp', 'Ralph Neuneier', 'Hans-Georg Zimmermann']"
1182,1996,Balancing Between Bagging and Bumping,,['Tom Heskes']
1183,1996,Adaptive On-line Learning in Changing Environments,,"['Noboru Murata', 'Shun-ichi Amari', 'Klaus-Robert M?ller', 'Andreas Ziehe']"
1184,1996,Radial Basis Function Networks and Complexity Regularization in Function Learning,,"['Adam Krzyzak', 'Tam?s Linder']"
1185,1996,Learning Decision Theoretic Utilities through Reinforcement Learning,,"['Terrence J. Sejnowski', 'Magnus Stensmo']"
1186,1996,Text-Based Information Retrieval Using Exponentiated Gradient Descent,,"['Andrew G. Barto', 'Ron Papka', 'James P. Callan']"
1187,1996,"Support Vector Method for Function Approximation, Regression Estimation and Signal Processing",,"['Vladimir Vapnik', 'Alex J. Smola', 'Steven E. Golowich']"
1188,1996,Spatiotemporal Coupling and Scaling of Natural Images and Human Visual Sensitivities,,['Dawei W. Dong']
1189,1996,Second-order Learning Algorithm with Squared Penalty Term,,"['Ryohei Nakano', 'Kazumi Saito']"
119,1988,Skeletonization: A Technique for Trimming the Fat from a Network via Relevance Assessment,,"['Paul Smolensky', 'Michael C. Mozer']"
1190,1996,Source Separation and Density Estimation by Faithful Equivariant SOM,,"['Jack D. Cowan', 'Juan K. Lin', 'David G. Grier']"
1191,1996,Regression with Input-Dependent Noise: A Bayesian Treatment,,"['Christopher M. Bishop', 'Cazhaow S. Quazaz']"
1192,1996,"Bangs, Clicks, Snaps, Thuds and Whacks: An Architecture for Acoustic Transient Processing",,"['Fernando J. Pineda', 'Gert Cauwenberghs', 'R. Timothy Edwards']"
1193,1996,A New Approach to Hybrid HMM/ANN Speech Recognition using Mutual Information Neural Networks,,"['Gerhard Rigoll', 'Christoph Neukirchen']"
1194,1996,An Apobayesian Relative of Winnow,,"['Nick Littlestone', 'Chris Mesterharm']"
1195,1996,Hebb Learning of Features based on their Information Content,,"['Ferdinand Peper', 'Hideki Noda']"
1196,1996,Competition Among Networks Improves Committee Performance,,"['Paul W. Munro', 'Bambang Parmanto']"
1197,1996,Computing with Infinite Networks,,['Christopher K. I. Williams']
