id,year,title,event_type,authors
445,1991,Human and Machine 'Quick Modeling',,"['Jakob Bernasconi', 'Karl Gustafson']"
4450,2011,Multiclass Boosting: Theory and Algorithms,,"['Nuno Vasconcelos', 'Mohammad J. Saberian']"
4451,2011,Understanding the Intrinsic Memorability of Images,,"['Antonio Torralba', 'Phillip Isola', 'Devi Parikh', 'Aude Oliva']"
4452,2011,Convergence Rates of Inexact Proximal-Gradient Methods for Convex Optimization,,"['Francis R. Bach', 'Nicolas L. Roux', 'Mark Schmidt']"
4453,2011,Statistical Performance of Convex Tensor Decomposition,,"['Ryota Tomioka', 'Hisashi Kashima', 'Taiji Suzuki', 'Kohei Hayashi']"
4454,2011,High-dimensional regression with noisy and missing data: Provable guarantees with non-convexity,,"['Martin J. Wainwright', 'Po-ling Loh']"
4455,2011,k-NN Regression Adapts to Local Intrinsic Dimension,,['Samory Kpotufe']
4456,2011,Unifying Non-Maximum Likelihood Learning Objectives with Minimum KL Contraction,,['Siwei Lyu']
4457,2011,Shaping Level Sets with Submodular Functions,,['Francis R. Bach']
4458,2011,Simultaneous Sampling and Multi-Structure Fitting with Adaptive Reversible Jump MCMC,,"['Jin Yu', 'Tat-jun Chin', 'David Suter', 'Trung T. Pham']"
4459,2011,Projection onto A Nonnegative Max-Heap,,"['Jieping Ye', 'Liang Sun', 'Jun Liu']"
446,1991,Decoding of Neuronal Signals in Visual Pattern Recognition,,"['John A. Hertz', 'Emad N. Eskandar', 'Barry J. Richmond', 'Lance M. Optican', 'Troels W. Kj?r']"
4460,2011,Maximal Cliques that Satisfy Hard Constraints with Application to Deformable Object Model Learning,,"['Longin J. Latecki', 'Xiang Bai', 'Xinggang Wang', 'Xingwei Yang', 'Wenyu Liu']"
4461,2011,Transfer Learning by Borrowing Examples for Multiclass Object Detection,,"['Antonio Torralba', 'Ruslan R. Salakhutdinov', 'Joseph J. Lim']"
4462,2011,Orthogonal Matching Pursuit with Replacement,,"['Inderjit S. Dhillon', 'Ambuj Tewari', 'Prateek Jain']"
4463,2011,Priors over Recurrent Continuous Time Processes,,"['Alexandre Bouchard-c?t?', 'Ardavan Saeedi']"
4464,2011,Quasi-Newton Methods for Markov Chain Monte Carlo,,"['Yichuan Zhang', 'Charles A. Sutton']"
4465,2011,"Online Submodular Set Cover, Ranking, and Repeated Active Learning",,"['Jeff A. Bilmes', 'Andrew Guillory']"
4466,2011,How Do Humans Teach: On Curriculum Learning and Teaching Dimension,,"['Xiaojin Zhu', 'Faisal Khan', 'Bilge Mutlu']"
4467,2011,ICA with Reconstruction Cost for Efficient Overcomplete Feature Learning,,"['Andrew Y. Ng', 'Quoc V. Le', 'Jiquan Ngiam', 'Alexandre Karpenko']"
4468,2011,Inferring spike-timing-dependent plasticity from spike train data,,"['Konrad Koerding', 'Ian Stevenson']"
4469,2011,Ranking annotators for crowdsourced labeling tasks,,"['Shipeng Yu', 'Vikas C. Raykar']"
447,1991,Neural Control for Rolling Mills: Incorporating Domain Theories to Overcome Data Deficiency,,"['Volker Tresp', 'Martin R?scheisen', 'Reimar Hofmann']"
4470,2011,Im2Text: Describing Images Using 1 Million Captioned Photographs,,"['Tamara L. Berg', 'Vicente Ordonez', 'Girish Kulkarni']"
4471,2011,Analytical Results for the Error in Filtering of Gaussian Processes,,"['Manfred Opper', 'Ron Meir', 'Alex K. Susemihl']"
4472,2011,TD_gamma: Re-evaluating Complex Backups in Temporal Difference Learning,,"['George Konidaris', 'Scott Niekum', 'Philip S. Thomas']"
4473,2011,Hierarchical Matching Pursuit for Image Classification: Architecture and Fast Algorithms,,"['Dieter Fox', 'Xiaofeng Ren', 'Liefeng Bo']"
4474,2011,Learning to Learn with Compound HD Models,,"['Joshua B. Tenenbaum', 'Antonio Torralba', 'Ruslan R. Salakhutdinov']"
4475,2011,Stochastic convex optimization with bandit feedback,,"['Sham M. Kakade', 'Alexander Rakhlin', 'Daniel J. Hsu', 'Alekh Agarwal', 'Dean P. Foster']"
4476,2011,See the Tree Through the Lines: The Shazoo Algorithm,,"['Claudio Gentile', 'Nicol? Cesa-bianchi', 'Fabio Vitale', 'Giovanni Zappella']"
4477,2011,Monte Carlo Value Iteration with Macro-Actions,,"['David Hsu', 'Zhan Lim', 'Lee Sun']"
4478,2011,Multi-Bandit Best Arm Identification,,"['Mohammad Ghavamzadeh', 'Alessandro Lazaric', 'S?bastien Bubeck', 'Victor Gabillon']"
4479,2011,MAP Inference for Bayesian Inverse Reinforcement Learning,,"['Jaedeug Choi', 'Kee-eung Kim']"
448,1991,Forward Dynamics Modeling of Speech Motor Control Using Physiological Data,,"['Mitsuo Kawato', 'Michael I. Jordan', 'Makoto Hirayama', 'Eric Vatikiotis-Bateson']"
4480,2011,Generalised Coupled Tensor Factorisation,,"['Kenan Y. Y?lmaz', 'Ali T. Cemgil', 'Umut Simsekli']"
4481,2011,Portmanteau Vocabularies for Multi-Cue Image Representation,,"['Fahad S. Khan', 'Joost Weijer', 'Andrew D. Bagdanov', 'Maria Vanrell']"
4482,2011,Learning Auto-regressive Models from Sequence and Non-sequence Data,,"['Jeff G. Schneider', 'Tzu-kuo Huang']"
4483,2011,Multiple Instance Learning on Structured Data,,"['Jian Zhang', 'Dan Zhang', 'Yan Liu', 'Luo Si', 'Richard D. Lawrence']"
4484,2011,Structured Learning for Cell Tracking,,"['Xinghua Lou', 'Fred A. Hamprecht']"
4485,2011,Action-Gap Phenomenon in Reinforcement Learning,,['Amir-massoud Farahmand']
4486,2011,Divide-and-Conquer Matrix Factorization,,"['Michael I. Jordan', 'Lester W. Mackey', 'Ameet Talwalkar']"
4487,2011,Contextual Gaussian Process Bandit Optimization,,"['Cheng S. Ong', 'Andreas Krause']"
4488,2012,Gradient-based kernel method for feature extraction and variable selection,,"['Kenji Fukumizu', 'Chenlei Leng']"
4489,2012,Efficient coding provides a direct link between prior and likelihood in perceptual Bayesian inference,,"['Alan A. Stocker', 'Xue-xin Wei']"
449,1991,Time-Warping Network: A Hybrid Framework for Speech Recognition,,"['Esther Levin', 'Roberto Pieraccini', 'Enrico Bocchieri']"
4490,2012,Learning from the Wisdom of Crowds by Minimax Entropy,,"['John C. Platt', 'Denny Zhou', 'Sumit Basu', 'Yi Mao']"
4491,2012,Efficient Sampling for Bipartite Matching Problems,,"['Richard S. Zemel', 'Maksims Volkovs']"
4492,2012,Learning Halfspaces with the Zero-One Loss: Time-Accuracy Tradeoffs,,"['Shai S. Shwartz', 'Aharon Birnbaum']"
4493,2012,FastEx: Hash Clustering with Exponential Families,,"['Alex J. Smola', 'Shravan M. Narayanamurthy', 'Amr Ahmed', 'Sujith Ravi']"
4494,2012,Bayesian Warped Gaussian Processes,,['Miguel L?zaro-Gredilla']
4495,2012,Active Comparison of Prediction Models,,"['Tobias Scheffer', 'Christoph Sawade', 'Niels Landwehr']"
4496,2012,Learning Multiple Tasks using Shared Hypotheses,,"['Yishay Mansour', 'Koby Crammer']"
4497,2012,Emergence of Object-Selective Features in Unsupervised Feature Learning,,"['Andrew Y. Ng', 'Adam Coates', 'Andrej Karpathy']"
4498,2012,Approximate Message Passing with Consistent Parameter Estimation and Applications to Sparse Learning,,"['Sundeep Rangan', 'Alyson K. Fletcher', 'Ulugbek Kamilov', 'Michael Unser']"
4499,2012,Structured Learning of Gaussian Graphical Models,,"['Su-in Lee', 'Karthik Mohan', 'Mike Chung', 'Seungyeop Han', 'Daniela Witten', 'Maryam Fazel']"
45,1987,An Optimization Network for Matrix Inversion,,"['Ju-Seog Jang', 'Soo-Young Lee', 'Sang-Yung Shin']"
450,1991,The Clusteron: Toward a Simple Abstraction for a Complex Neuron,,['Bartlett W. Mel']
4500,2012,Dimensionality Dependent PAC-Bayes Margin Bound,,"['Liwei Wang', 'Chi Jin']"
4501,2012,Simultaneously Leveraging Output and Task Structures for Multiple-Output Regression,,"['Piyush Rai', 'Hal Daume', 'Abhishek Kumar']"
4502,2012,High-Order Multi-Task Feature Learning to Identify Longitudinal Phenotypic Markers for Alzheimer's Disease Progression Prediction,,"['Feiping Nie', 'Heng Huang', 'Hua Wang', 'Jingwen Yan', 'Sungeun Kim', 'Shannon Risacher', 'Andrew Saykin', 'Li Shen']"
4503,2012,"The Lov?sz ? function, SVMs and finding large dense subgraphs",,"['Chiranjib Bhattacharyya', 'Vinay Jethava', 'Anders Martinsson', 'Devdatt Dubhashi']"
4504,2012,Recovery of Sparse Probability Measures via Convex Programming,,"['Laurent E. Ghaoui', 'Venkat Chandrasekaran', 'Mert Pilanci']"
4505,2012,Privacy Aware Learning,,"['Michael I. Jordan', 'Martin J. Wainwright', 'John C. Duchi']"
4506,2012,Multiplicative Forests for Continuous-Time Processes,,"['Jeremy Weiss', 'Sriraam Natarajan', 'David Page']"
4507,2012,Dual-Space Analysis of the Sparse Linear Model,,"['David P. Wipf', 'Yi Wu']"
4508,2012,Supervised Learning with Similarity Functions,,"['Prateek Jain', 'Purushottam Kar']"
4509,2012,Query Complexity of Derivative-Free Optimization,,"['Robert Nowak', 'Ben Recht', 'Kevin G. Jamieson']"
451,1991,Neural Network Diagnosis of Avascular Necrosis from Magnetic Resonance Images,,"['Armando Manduca', 'Paul Christy', 'Richard Ehman']"
4510,2012,Reducing statistical time-series problems to binary classification,,"['Daniil Ryabko', 'Jeremie Mary']"
4511,2012,On Lifting the Gibbs Sampling Algorithm,,"['Vibhav Gogate', 'Deepak Venugopal']"
4512,2012,Affine Independent Variational Inference,,"['David Barber', 'Edward Challis']"
4513,2012,Predicting Action Content On-Line and in Real Time before Action Onset ? an Intracranial Human Study,,"['Christof Koch', 'Uri Maoz', 'Shengxuan Ye', 'Ian Ross', 'Adam Mamelak']"
4514,2012,Risk Aversion in Markov Decision Processes via Near Optimal Chernoff Bounds,,"['Pieter Abbeel', 'Teodor M. Moldovan']"
4515,2012,Strategic Impatience in Go/NoGo versus Forced-Choice Decision-Making,,"['Angela J. Yu', 'Pradeep Shenoy']"
4516,2012,Discriminative Learning of Sum-Product Networks,,"['Pedro Domingos', 'Robert Gens']"
4517,2012,Meta-Gaussian Information Bottleneck,,"['Volker Roth', 'Melanie Rey']"
4518,2012,Factoring nonnegative matrices with linear programs,,"['Joel Tropp', 'Ben Recht', 'Christopher Re', 'Victor Bittorf']"
4519,2012,Adaptive Stratified Sampling for Monte-Carlo integration of Differentiable functions,,"['R?mi Munos', 'Alexandra Carpentier']"
452,1991,Obstacle Avoidance through Reinforcement Learning,,"['Tony J. Prescott', 'John E. W. Mayhew']"
4520,2012,Mandatory Leaf Node Prediction in Hierarchical Multilabel Classification,,"['James T. Kwok', 'Wei Bi']"
4521,2012,Bayesian estimation of discrete entropy with mixtures of stick-breaking priors,,"['Jonathan W. Pillow', 'Il Memming Park', 'Evan Archer']"
4522,2012,Practical Bayesian Optimization of Machine Learning Algorithms,,"['Hugo Larochelle', 'Ryan P. Adams', 'Jasper Snoek']"
4523,2012,A quasi-Newton proximal splitting method,,"['Stephen Becker', 'Jalal Fadili']"
4524,2012,A Polylog Pivot Steps Simplex Algorithm for Classification,,"['Elad Hazan', 'Zohar Karnin']"
4525,2012,Patient Risk Stratification for Hospital-Associated C. diff as a Time-Series Classification Task,,"['Eric Horvitz', 'John V. Guttag', 'Jenna Wiens']"
4526,2012,Deep Spatio-Temporal Architectures and Learning for Protein Structure Prediction,,"['Pierre F. Baldi', 'Pietro D. Lena', 'Ken Nagata']"
4527,2012,Synchronization can Control Regularization in Neural Systems via Correlated Noise Processes,,"['Jean-jeacques Slotine', 'Jake Bouvrie']"
4528,2012,Classification Calibration Dimension for General Multiclass Losses,,"['Shivani Agarwal', 'Harish G. Ramaswamy']"
4529,2012,Interpreting prediction markets: a stochastic approach,,"['Mark D. Reid', 'Rafael M. Frongillo', 'Nichol?s Della Penna']"
453,1991,Experimental Evaluation of Learning in a Neural Microsystem,,"['Joshua Alspector', 'Anthony Jayakumar', 'Stephan Luna']"
4530,2012,Latent Graphical Model Selection: Efficient Methods for Locally Tree-like Graphs,,"['Anima Anandkumar', 'Ragupathyraj Valluvan']"
4531,2012,Sparse Approximate Manifolds for Differential Geometric MCMC,,"['Ben Calderhead', 'M?ty?s A. Sustik']"
4532,2012,Learning to Discover Social Circles in Ego Networks,,"['Julian J. Mcauley', 'Jure Leskovec']"
4533,2012,Perceptron Learning of SAT,,"['Matthew Blaschko', 'Alex Flint']"
4534,2012,Truncation-free Online Variational Inference for Bayesian Nonparametric Models,,"['David M. Blei', 'Chong Wang']"
4535,2012,Fast Bayesian Inference for Non-Conjugate Gaussian Process Regression,,"['Kevin P. Murphy', 'Shakir Mohamed', 'Emtiyaz Khan']"
4536,2012,A Nonparametric Conjugate Prior Distribution for the Maximizing Argument of a Noisy Function,,"['David Balduzzi', 'Pedro Ortega', 'Jordi Grau-moya', 'Tim Genewein', 'Daniel Braun']"
4537,2012,Sparse Prediction with the ,,"['Nathan Srebro', 'Andreas Argyriou', 'Rina Foygel']"
4538,2012,A Convex Formulation for Learning Scale-Free Networks via Submodular Relaxation,,"['Tib?rio S. Caetano', 'Aaron Defazio']"
4539,2012,A Geometric take on Metric Learning,,"['Michael J. Black', 'S?ren Hauberg', 'Oren Freifeld']"
454,1991,Gradient Descent: Second Order Momentum and Saturating Error,,['Barak Pearlmutter']
4540,2012,Sketch-Based Linear Value Function Approximation,,"['Michael Bowling', 'Joel Veness', 'Marc Bellemare']"
4541,2012,Causal discovery with scale-mixture model for spatiotemporal variance dependencies,,"['Kun Zhang', 'Zhitang Chen', 'Laiwan Chan']"
4542,2012,Tight Bounds on Profile Redundancy and Distinguishability,,"['Alon Orlitsky', 'Jayadev Acharya', 'Hirakendu Das']"
4543,2012,Optimal Regularized Dual Averaging Methods for Stochastic Optimization,,"['Xi Chen', 'Qihang Lin', 'Javier Pena']"
4544,2012,Learning the Architecture of Sum-Product Networks Using Clustering on Variables,,"['Dan Ventura', 'Aaron Dennis']"
4545,2012,Imitation Learning by Coaching,,"['Hal Daume', 'Jason Eisner', 'He He']"
4546,2012,A Divide-and-Conquer Method for Sparse Inverse Covariance Estimation,,"['Inderjit S. Dhillon', 'Pradeep K. Ravikumar', 'Cho-jui Hsieh', 'Arindam Banerjee']"
4547,2012,Non-parametric Approximate Dynamic Programming via the Kernel Method,,"['Ciamac C. Moallemi', 'Vivek Farias', 'Nikhil Bhat']"
4548,2012,A Simple and Practical Algorithm for Differentially Private Data Release,,"['Frank Mcsherry', 'Moritz Hardt', 'Katrina Ligett']"
4549,2012,Multiple Choice Learning: Learning to Produce Multiple Structured Outputs,,"['Pushmeet Kohli', 'Abner Guzm?n-rivera', 'Dhruv Batra']"
455,1991,Temporal Adaptation in a Silicon Auditory Nerve,,['John Lazzaro']
4550,2012,Finite Sample Convergence Rates of Zero-Order Stochastic Optimization Methods,,"['Michael I. Jordan', 'Martin J. Wainwright', 'John C. Duchi', 'Andre Wibisono']"
4551,2012,Inverse Reinforcement Learning through Structured Classification,,"['Edouard Klein', 'Matthieu Geist', 'Bilal Piot', 'Olivier Pietquin']"
4552,2012,Bayesian active learning with localized priors for fast receptive field characterization,,"['Jonathan W. Pillow', 'Mijung Park']"
4553,2012,Learning High-Density Regions for a Generalized Kolmogorov-Smirnov Test in High-Dimensional Data,,"['Shaul Markovitch', 'Assaf Glazer', 'Michael Lindenbaum']"
4554,2012,Slice Normalized Dynamic Markov Logic Networks,,"['Henry Kautz', 'Tivadar Papai', 'Daniel Stefankovic']"
4555,2012,Complex Inference in Neural Circuits with Probabilistic Population Codes and Topic Models,,"['Alexandre Pouget', 'Katherine A. Heller', 'Jeff Beck']"
4556,2012,Learned Prioritization for Trading Off Accuracy and Speed,,"['Hal Daume', 'Jiarong Jiang', 'Adam Teichert', 'Jason Eisner']"
4557,2012,Putting Bayes to sleep,,"['Manfred K. Warmuth', 'Wouter M. Koolen', 'Dmitry Adamskiy']"
4558,2012,A Polynomial-time Form of Robust Regression,,"['Dale Schuurmans', 'Yao-liang Yu', '?zlem Aslan']"
4559,2012,Multi-Task Averaging,,"['Maya Gupta', 'Bela Frigyik', 'Sergey Feldman']"
456,1991,Shooting Craps in Search of an Optimal Strategy for Training Connectionist Pattern Classifiers,,"['J. B. Hampshire II', 'B. V. K. Vijaya Kumar']"
4560,2012,Semi-supervised Eigenvectors for Locally-biased Learning,,"['Michael W. Mahoney', 'Toke Hansen']"
4561,2012,Feature-aware Label Space Dimension Reduction for Multi-label Classification,,"['Hsuan-tien Lin', 'Yao-nan Chen']"
4562,2012,3D Object Detection and Viewpoint Estimation with a Deformable 3D Cuboid Model,,"['Sanja Fidler', 'Raquel Urtasun', 'Sven Dickinson']"
4563,2012,Distributed Non-Stochastic Experts,,"['Varun Kanade', 'Zhenming Liu', 'Bozidar Radunovic']"
4564,2012,On Triangular versus Edge Representations --- Towards Scalable Modeling of Networks,,"['Eric P. Xing', 'Qirong Ho', 'Junming Yin']"
4565,2012,Near-optimal Differentially Private Principal Components,,"['Kaushik Sinha', 'Kamalika Chaudhuri', 'Anand Sarwate']"
4566,2012,Communication/Computation Tradeoffs in Consensus-Based Distributed Optimization,,"['Michael G. Rabbat', 'Konstantinos Tsianos', 'Sean Lawlor']"
4567,2012,Fully Bayesian inference for neural models with negative-binomial spiking,,"['Jonathan W. Pillow', 'James Scott']"
4568,2012,Dynamic Pruning of Factor Graphs for Maximum Marginal Prediction,,['Christoph H. Lampert']
4569,2012,Efficient Monte Carlo Counterfactual Regret Minimization in Games with Many Player Actions,,"['Marc Lanctot', 'Richard G. Gibson', 'Duane Szafron', 'Neil Burch']"
457,1991,Constant-Time Loading of Shallow 1-Dimensional Networks,,['Stephen Judd']
4570,2012,Memorability of Image Regions,,"['Antonio Torralba', 'Aude Oliva', 'Aditya Khosla', 'Jianxiong Xiao']"
4571,2012,Online L1-Dictionary Learning with Application to Novel Document Detection,,"['Shiva P. Kasiviswanathan', 'Huahua Wang', 'Arindam Banerjee', 'Prem Melville']"
4572,2012,Random function priors for exchangeable arrays with applications to graphs and relational data,,"['Zoubin Ghahramani', 'Daniel M. Roy', 'Peter Orbanz', 'James Lloyd']"
4573,2012,Scalable Inference of Overlapping Communities,,"['David M. Blei', 'Sean Gerrish', 'David M. Mimno', 'Prem K. Gopalan', 'Michael Freedman']"
4574,2012,Iterative Thresholding Algorithm for Sparse Inverse Covariance Estimation,,"['Benjamin Rolfs', 'Bala Rajaratnam', 'Dominique Guillot', 'Ian Wong', 'Arian Maleki']"
4575,2012,Selective Labeling via Error Bound Minimization,,"['Tong Zhang', 'Chris H. Ding', 'Jiawei Han', 'Quanquan Gu']"
4576,2012,A Unifying Perspective of Parametric Policy Search Methods for Markov Decision Processes,,"['David Barber', 'Thomas Furmston']"
4577,2012,Near-Optimal MAP Inference for Determinantal Point Processes,,"['Ben Taskar', 'Alex Kulesza', 'Jennifer Gillenwater']"
4578,2012,Approximating Concavely Parameterized Optimization Problems,,"['Joachim Giesen', 'Jens Mueller', 'Soeren Laue', 'Sascha Swiercy']"
4579,2012,A nonparametric variable clustering model,,"['Zoubin Ghahramani', 'David A. Knowles', 'Konstantina Palla']"
458,1991,A Connectionist Learning Approach to Analyzing Linguistic Stress,,"['David S. Touretzky', 'Prahlad Gupta']"
4580,2012,Hierarchical Optimistic Region Selection driven by Curiosity,,['Odalric-ambrym Maillard']
4581,2012,Nonparametric Max-Margin Matrix Factorization for Collaborative Prediction,,"['Jun Zhu', 'Bo Zhang', 'Minjie Xu']"
4582,2012,Learning Networks of Heterogeneous Influence,,"['Alex J. Smola', 'Le Song', 'Nan Du', 'Ming Yuan']"
4583,2012,Symmetric Correspondence Topic Models for Multilingual Text Analysis,,"['Eric P. Xing', 'Kosuke Fukumasu', 'Koji Eguchi']"
4584,2012,Structure estimation for discrete graphical models: Generalized covariance matrices and their inverses,,"['Martin J. Wainwright', 'Po-ling Loh']"
4585,2012,Multi-scale Hyper-time Hardware Emulation of Human Motor Nervous System Based on Spiking Neurons using FPGA,,"['C. M. Niu', 'Sirish Nandyala', 'Won J. Sohn', 'Terence Sanger']"
4586,2012,Online Sum-Product Computation Over Trees,,"['Mark Herbster', 'Fabio Vitale', 'Stephen Pasteris']"
4587,2012,Phoneme Classification using Constrained Variational Gaussian Process Dynamical System,,"['Jongmin Kim', 'Chang D. Yoo', 'Hyunsin Park', 'Sungrack Yun', 'Sanghyuk Park']"
4588,2012,Nystr?m Method vs Random Fourier Features: A Theoretical and Empirical Comparison,,"['Rong Jin', 'Tianbao Yang', 'Yu-feng Li', 'Mehrdad Mahdavi', 'Zhi-Hua Zhou']"
4589,2012,Repulsive Mixtures,,"['Vinayak Rao', 'David B. Dunson', 'Francesca Petralia']"
459,1991,Kernel Regression and Backpropagation Training With Noise,,"['Petri Koistinen', 'Lasse Holmstr?m']"
4590,2012,Kernel Latent SVM for Visual Recognition,,"['Yang Wang', 'Greg Mori', 'Weilong Yang', 'Arash Vahdat']"
4591,2012,Multilabel Classification using Bayesian Compressed Sensing,,"['Ashish Kapoor', 'Prateek Jain', 'Raajay Viswanathan']"
4592,2012,Kernel Hyperalignment,,"['Peter J. Ramadge', 'Alexander Lorbert']"
4593,2012,Homeostatic plasticity in Bayesian spiking networks as Expectation Maximization with posterior constraints,,"['Bernhard Nessler', 'Stefan Habenschuss', 'Johannes Bill']"
4594,2012,Controlled Recognition Bounds for Visual Learning and Exploration,,"['Stefano Soatto', 'Alessandro Chiuso', 'Vasiliy Karasev']"
4595,2012,Waveform Driven Plasticity in BiFeO3 Memristive Devices: Model and Implementation,,"['Christian Mayr', 'Paul St?rke', 'Johannes Partzsch', 'Love Cederstroem', 'Rene Sch?ffny', 'Yao Shuai', 'Nan Du', 'Heidemarie Schmidt']"
4596,2012,Fused sparsity and robust estimation for linear models with unknown variance,,"['Arnak Dalalyan', 'Yin Chen']"
4597,2012,A Conditional Multinomial Mixture Model for Superset Label Learning,,"['Thomas G. Dietterich', 'Liping Liu']"
4598,2012,A Linear Time Active Learning Algorithm for Link Classification,,"['Claudio Gentile', 'Nicol? Cesa-bianchi', 'Fabio Vitale', 'Giovanni Zappella']"
4599,2012,On-line Reinforcement Learning Using Incremental Kernel-Based Stochastic Factorization,,"['Doina Precup', 'Joelle Pineau', 'Andre S. Barreto']"
46,1987,Performance Measures for Associative Memories that Learn and Forget,,['Anthony Kuh']
460,1991,Models Wanted: Must Fit Dimensions of Sleep and Dreaming,,"['J. Allan Hobson', 'Adam N. Mamelak', 'Jeffrey P. Sutton']"
4600,2012,"Compressive neural representation of sparse, high-dimensional probabilities",,['Xaq Pitkow']
4601,2012,Newton-Like Methods for Sparse Inverse Covariance Estimation,,"['Steven Rennie', 'Peder A. Olsen', 'Figen Oztoprak', 'Jorge Nocedal']"
4602,2012,Bayesian Pedigree Analysis using Measure Factorization,,"['Alexandre Bouchard-c?t?', 'Bonnie Kirkpatrick']"
4603,2012,"Provable ICA with Unknown Gaussian Noise, with Implications for Gaussian Mixtures and Autoencoders",,"['Sanjeev Arora', 'Rong Ge', 'Ankur Moitra', 'Sushant Sachdeva']"
4604,2012,Minimizing Uncertainty in Pipelines,,"['Nilesh Dalvi', 'Aditya Parameswaran', 'Vibhor Rastogi']"
4605,2012,Learning as MAP Inference in Discrete Graphical Models,,"['Tib?rio S. Caetano', 'James Petterson', 'Xianghang Liu']"
4606,2012,Truly Nonparametric Online Variational Inference for Hierarchical Dirichlet Processes,,"['Erik B. Sudderth', 'Michael Bryant']"
4607,2012,Fiedler Random Fields: A Large-Scale Spectral Approach to Statistical Network Modeling,,"['Mikaela Keller', 'Antonino Freno', 'Marc Tommasi']"
4608,2012,A systematic approach to extracting semantic information from functional MRI data,,"['Francisco Pereira', 'Matthew Botvinick']"
4609,2012,Bayesian models for Large-scale Hierarchical Classification,,"['Yiming Yang', 'Bing Bai', 'Siddharth Gopal', 'Alexandru Niculescu-mizil']"
461,1991,Recognizing Overlapping Hand-Printed Characters by Centered-Object Integrated Segmentation and Recognition,,"['Gale L. Martin', 'Mosfeq Rashid']"
4610,2012,A Better Way to Pretrain Deep Boltzmann Machines,,"['Geoffrey E. Hinton', 'Ruslan R. Salakhutdinov']"
4611,2012,Gradient Weights help Nonparametric Regressors,,"['Samory Kpotufe', 'Abdeslam Boularias']"
4612,2012,Multi-criteria Anomaly Detection using Pareto Depth Analysis,,"['Alfred O. Hero', 'Ko-jen Hsiao', 'Kevin Xu', 'Jeff Calder']"
4613,2012,A Neural Autoregressive Topic Model,,"['Hugo Larochelle', 'Stanislas Lauly']"
4614,2012,Monte Carlo Methods for Maximum Margin Supervised Topic Models,,"['Eric P. Xing', 'Jun Zhu', 'Qixia Jiang', 'Maosong Sun']"
4615,2012,Matrix reconstruction with the local max norm,,"['Nathan Srebro', 'Ruslan R. Salakhutdinov', 'Rina Foygel']"
4616,2012,Bandit Algorithms boost Brain Computer Interfaces for motor-task selection of a brain-controlled button,,"['R?mi Munos', 'Alexandra Carpentier', 'Joan Fruitet', 'Maureen Clerc']"
4617,2012,Graphical Models via Generalized Linear Models,,"['Pradeep K. Ravikumar', 'Eunho Yang', 'Genevera Allen', 'Zhandong Liu']"
4618,2012,CPRL -- An Extension of Compressive Sensing to the Phase Retrieval Problem,,"['Shankar Sastry', 'Henrik Ohlsson', 'Allen Yang', 'Roy Dong']"
4619,2012,3D Social Saliency from Head-mounted Cameras,,"['Yaser Sheikh', 'Hyun S. Park', 'Eakta Jain']"
462,1991,Against Edges: Function Approximation with Multiple Support Maps,,"['Trevor Darrell', 'Alex Pentland']"
4620,2012,Learning Label Trees for Probabilistic Modelling of Implicit Feedback,,"['Yee W. Teh', 'Andriy Mnih']"
4621,2012,Effective Split-Merge Monte Carlo Methods for Nonparametric Models of Sequential Data,,"['Erik B. Sudderth', 'Emily Fox', 'Michael C. Hughes']"
4622,2012,Tensor Decomposition for Fast Parsing with Latent-Variable PCFGs,,"['Michael Collins', 'Shay B. Cohen']"
4623,2012,Locating Changes in Highly Dependent Data with Unknown Number of Change Points,,"['Daniil Ryabko', 'Azadeh Khaleghi']"
4624,2012,Bayesian nonparametric models for ranked data,,"['Yee W. Teh', 'Francois Caron']"
4625,2012,Value Pursuit Iteration,,"['Doina Precup', 'Amir M. Farahmand']"
4626,2012,Exact and Stable Recovery of Sequences of Signals with Sparse Increments via Differential _1-Minimization,,"['Demba Ba', 'Behtash Babadi', 'Patrick Purdon', 'Emery Brown']"
4627,2012,Variational Inference for Crowdsourcing,,"['Jian Peng', 'Qiang Liu', 'Alexander T. Ihler']"
4628,2012,Forward-Backward Activation Algorithm for Hierarchical Hidden Markov Models,,"['Kei Wakabayashi', 'Takao Miura']"
4629,2012,Distributed Probabilistic Learning for Camera Networks with Missing Data,,"['Vladimir Pavlovic', 'Sejong Yoon']"
463,1991,Illumination and View Position in 3D Visual Recognition,,['Amnon Shashua']
4630,2012,Compressive Sensing MRI with Wavelet Tree Sparsity,,"['Chen Chen', 'Junzhou Huang']"
4631,2012,On the connections between saliency and tracking,,"['Nuno Vasconcelos', 'Vijay Mahadevan']"
